Warm Spell Duration Index - (Days), Year, Model, Statistics, ISO3
3.66165, 2040-2059, access1_0, Jan Anomaly, NPL
3.81462, 2040-2059, access1_0, Feb Anomaly, NPL
4.16911, 2040-2059, access1_0, Mar Anomaly, NPL
2.88335, 2040-2059, access1_0, Apr Anomaly, NPL
1.0491, 2040-2059, access1_0, May Anomaly, NPL
2.96151, 2040-2059, access1_0, Jun Anomaly, NPL
2.41739, 2040-2059, access1_0, Jul Anomaly, NPL
2.18965, 2040-2059, access1_0, Aug Anomaly, NPL
7.94252, 2040-2059, access1_0, Sep Anomaly, NPL
10.6592, 2040-2059, access1_0, Oct Anomaly, NPL
10.1733, 2040-2059, access1_0, Nov Anomaly, NPL
7.29517, 2040-2059, access1_0, Dec Anomaly, NPL
5.26936, 2040-2059, access1_3, Jan Anomaly, NPL
2.04961, 2040-2059, access1_3, Feb Anomaly, NPL
2.31768, 2040-2059, access1_3, Mar Anomaly, NPL
5.73279, 2040-2059, access1_3, Apr Anomaly, NPL
1.83208, 2040-2059, access1_3, May Anomaly, NPL
2.6054, 2040-2059, access1_3, Jun Anomaly, NPL
2.08221, 2040-2059, access1_3, Jul Anomaly, NPL
2.37294, 2040-2059, access1_3, Aug Anomaly, NPL
5.09674, 2040-2059, access1_3, Sep Anomaly, NPL
5.69909, 2040-2059, access1_3, Oct Anomaly, NPL
5.05888, 2040-2059, access1_3, Nov Anomaly, NPL
6.74332, 2040-2059, access1_3, Dec Anomaly, NPL
2.37462, 2040-2059, bcc_csm1_1_m, Jan Anomaly, NPL
0.54373, 2040-2059, bcc_csm1_1_m, Feb Anomaly, NPL
3.93737, 2040-2059, bcc_csm1_1_m, Mar Anomaly, NPL
5.65043, 2040-2059, bcc_csm1_1_m, Apr Anomaly, NPL
6.44916, 2040-2059, bcc_csm1_1_m, May Anomaly, NPL
3.94319, 2040-2059, bcc_csm1_1_m, Jun Anomaly, NPL
1.42365, 2040-2059, bcc_csm1_1_m, Jul Anomaly, NPL
1.21865, 2040-2059, bcc_csm1_1_m, Aug Anomaly, NPL
1.66495, 2040-2059, bcc_csm1_1_m, Sep Anomaly, NPL
1.56334, 2040-2059, bcc_csm1_1_m, Oct Anomaly, NPL
3.70918, 2040-2059, bcc_csm1_1_m, Nov Anomaly, NPL
1.56665, 2040-2059, bcc_csm1_1_m, Dec Anomaly, NPL
4.98976, 2040-2059, bcc_csm1_1, Jan Anomaly, NPL
1.14793, 2040-2059, bcc_csm1_1, Feb Anomaly, NPL
1.25647, 2040-2059, bcc_csm1_1, Mar Anomaly, NPL
7.19569, 2040-2059, bcc_csm1_1, Apr Anomaly, NPL
4.86681, 2040-2059, bcc_csm1_1, May Anomaly, NPL
3.09361, 2040-2059, bcc_csm1_1, Jun Anomaly, NPL
1.56113, 2040-2059, bcc_csm1_1, Jul Anomaly, NPL
1.48205, 2040-2059, bcc_csm1_1, Aug Anomaly, NPL
2.28234, 2040-2059, bcc_csm1_1, Sep Anomaly, NPL
3.48946, 2040-2059, bcc_csm1_1, Oct Anomaly, NPL
2.29283, 2040-2059, bcc_csm1_1, Nov Anomaly, NPL
1.61917, 2040-2059, bcc_csm1_1, Dec Anomaly, NPL
9.45227, 2040-2059, bnu_esm, Jan Anomaly, NPL
4.23603, 2040-2059, bnu_esm, Feb Anomaly, NPL
7.88345, 2040-2059, bnu_esm, Mar Anomaly, NPL
4.64321, 2040-2059, bnu_esm, Apr Anomaly, NPL
3.14807, 2040-2059, bnu_esm, May Anomaly, NPL
4.13425, 2040-2059, bnu_esm, Jun Anomaly, NPL
2.33017, 2040-2059, bnu_esm, Jul Anomaly, NPL
0.53602, 2040-2059, bnu_esm, Aug Anomaly, NPL
0.90669, 2040-2059, bnu_esm, Sep Anomaly, NPL
2.26055, 2040-2059, bnu_esm, Oct Anomaly, NPL
2.69475, 2040-2059, bnu_esm, Nov Anomaly, NPL
8.44561, 2040-2059, bnu_esm, Dec Anomaly, NPL
3.006, 2040-2059, ccsm4, Jan Anomaly, NPL
2.44002, 2040-2059, ccsm4, Feb Anomaly, NPL
5.70406, 2040-2059, ccsm4, Mar Anomaly, NPL
6.20592, 2040-2059, ccsm4, Apr Anomaly, NPL
4.31418, 2040-2059, ccsm4, May Anomaly, NPL
4.91474, 2040-2059, ccsm4, Jun Anomaly, NPL
1.2725, 2040-2059, ccsm4, Jul Anomaly, NPL
1.38411, 2040-2059, ccsm4, Aug Anomaly, NPL
0.6956, 2040-2059, ccsm4, Sep Anomaly, NPL
4.28738, 2040-2059, ccsm4, Oct Anomaly, NPL
2.42183, 2040-2059, ccsm4, Nov Anomaly, NPL
2.10937, 2040-2059, ccsm4, Dec Anomaly, NPL
1.9229, 2040-2059, cesm1_bgc, Jan Anomaly, NPL
0.54293, 2040-2059, cesm1_bgc, Feb Anomaly, NPL
1.24472, 2040-2059, cesm1_bgc, Mar Anomaly, NPL
2.6264, 2040-2059, cesm1_bgc, Apr Anomaly, NPL
7.47177, 2040-2059, cesm1_bgc, May Anomaly, NPL
3.75204, 2040-2059, cesm1_bgc, Jun Anomaly, NPL
3.0185, 2040-2059, cesm1_bgc, Jul Anomaly, NPL
0.68885, 2040-2059, cesm1_bgc, Aug Anomaly, NPL
2.20301, 2040-2059, cesm1_bgc, Sep Anomaly, NPL
3.84545, 2040-2059, cesm1_bgc, Oct Anomaly, NPL
1.8373, 2040-2059, cesm1_bgc, Nov Anomaly, NPL
0.97189, 2040-2059, cesm1_bgc, Dec Anomaly, NPL
2.74965, 2040-2059, cesm1_cam5, Jan Anomaly, NPL
1.31157, 2040-2059, cesm1_cam5, Feb Anomaly, NPL
1.32423, 2040-2059, cesm1_cam5, Mar Anomaly, NPL
5.17737, 2040-2059, cesm1_cam5, Apr Anomaly, NPL
4.66937, 2040-2059, cesm1_cam5, May Anomaly, NPL
2.10315, 2040-2059, cesm1_cam5, Jun Anomaly, NPL
0.58436, 2040-2059, cesm1_cam5, Jul Anomaly, NPL
1.11087, 2040-2059, cesm1_cam5, Aug Anomaly, NPL
2.30668, 2040-2059, cesm1_cam5, Sep Anomaly, NPL
5.5486, 2040-2059, cesm1_cam5, Oct Anomaly, NPL
5.74536, 2040-2059, cesm1_cam5, Nov Anomaly, NPL
1.61339, 2040-2059, cesm1_cam5, Dec Anomaly, NPL
3.19189, 2040-2059, cmcc_cm, Jan Anomaly, NPL
4.09519, 2040-2059, cmcc_cm, Feb Anomaly, NPL
2.83596, 2040-2059, cmcc_cm, Mar Anomaly, NPL
5.6216, 2040-2059, cmcc_cm, Apr Anomaly, NPL
8.80222, 2040-2059, cmcc_cm, May Anomaly, NPL
5.18865, 2040-2059, cmcc_cm, Jun Anomaly, NPL
2.72803, 2040-2059, cmcc_cm, Jul Anomaly, NPL
1.96903, 2040-2059, cmcc_cm, Aug Anomaly, NPL
2.65579, 2040-2059, cmcc_cm, Sep Anomaly, NPL
3.66116, 2040-2059, cmcc_cm, Oct Anomaly, NPL
6.23035, 2040-2059, cmcc_cm, Nov Anomaly, NPL
4.00728, 2040-2059, cmcc_cm, Dec Anomaly, NPL
7.11548, 2040-2059, cmcc_cms, Jan Anomaly, NPL
6.93238, 2040-2059, cmcc_cms, Feb Anomaly, NPL
5.10349, 2040-2059, cmcc_cms, Mar Anomaly, NPL
5.02658, 2040-2059, cmcc_cms, Apr Anomaly, NPL
8.50584, 2040-2059, cmcc_cms, May Anomaly, NPL
5.18939, 2040-2059, cmcc_cms, Jun Anomaly, NPL
3.27627, 2040-2059, cmcc_cms, Jul Anomaly, NPL
1.54057, 2040-2059, cmcc_cms, Aug Anomaly, NPL
1.54594, 2040-2059, cmcc_cms, Sep Anomaly, NPL
4.31766, 2040-2059, cmcc_cms, Oct Anomaly, NPL
4.63035, 2040-2059, cmcc_cms, Nov Anomaly, NPL
8.52922, 2040-2059, cmcc_cms, Dec Anomaly, NPL
3.40784, 2040-2059, cnrm_cm5, Jan Anomaly, NPL
4.31117, 2040-2059, cnrm_cm5, Feb Anomaly, NPL
2.69791, 2040-2059, cnrm_cm5, Mar Anomaly, NPL
7.89245, 2040-2059, cnrm_cm5, Apr Anomaly, NPL
5.78989, 2040-2059, cnrm_cm5, May Anomaly, NPL
2.66166, 2040-2059, cnrm_cm5, Jun Anomaly, NPL
0.07382, 2040-2059, cnrm_cm5, Jul Anomaly, NPL
0.17775, 2040-2059, cnrm_cm5, Aug Anomaly, NPL
1.86335, 2040-2059, cnrm_cm5, Sep Anomaly, NPL
2.59147, 2040-2059, cnrm_cm5, Oct Anomaly, NPL
2.77898, 2040-2059, cnrm_cm5, Nov Anomaly, NPL
2.50116, 2040-2059, cnrm_cm5, Dec Anomaly, NPL
6.104, 2040-2059, csiro_mk3_6_0, Jan Anomaly, NPL
5.32825, 2040-2059, csiro_mk3_6_0, Feb Anomaly, NPL
3.62674, 2040-2059, csiro_mk3_6_0, Mar Anomaly, NPL
4.62702, 2040-2059, csiro_mk3_6_0, Apr Anomaly, NPL
6.65017, 2040-2059, csiro_mk3_6_0, May Anomaly, NPL
8.2438, 2040-2059, csiro_mk3_6_0, Jun Anomaly, NPL
5.40858, 2040-2059, csiro_mk3_6_0, Jul Anomaly, NPL
2.1847, 2040-2059, csiro_mk3_6_0, Aug Anomaly, NPL
1.06597, 2040-2059, csiro_mk3_6_0, Sep Anomaly, NPL
3.80795, 2040-2059, csiro_mk3_6_0, Oct Anomaly, NPL
6.50541, 2040-2059, csiro_mk3_6_0, Nov Anomaly, NPL
6.66959, 2040-2059, csiro_mk3_6_0, Dec Anomaly, NPL
5.76502, 2040-2059, gfdl_cm3, Jan Anomaly, NPL
4.98221, 2040-2059, gfdl_cm3, Feb Anomaly, NPL
4.09249, 2040-2059, gfdl_cm3, Mar Anomaly, NPL
1.77736, 2040-2059, gfdl_cm3, Apr Anomaly, NPL
8.79772, 2040-2059, gfdl_cm3, May Anomaly, NPL
11.6098, 2040-2059, gfdl_cm3, Jun Anomaly, NPL
12.9768, 2040-2059, gfdl_cm3, Jul Anomaly, NPL
18.9804, 2040-2059, gfdl_cm3, Aug Anomaly, NPL
13.2378, 2040-2059, gfdl_cm3, Sep Anomaly, NPL
11.6525, 2040-2059, gfdl_cm3, Oct Anomaly, NPL
7.09716, 2040-2059, gfdl_cm3, Nov Anomaly, NPL
8.41545, 2040-2059, gfdl_cm3, Dec Anomaly, NPL
2.47901, 2040-2059, gfdl_esm2g, Jan Anomaly, NPL
1.14596, 2040-2059, gfdl_esm2g, Feb Anomaly, NPL
3.56827, 2040-2059, gfdl_esm2g, Mar Anomaly, NPL
2.46852, 2040-2059, gfdl_esm2g, Apr Anomaly, NPL
4.94456, 2040-2059, gfdl_esm2g, May Anomaly, NPL
4.23571, 2040-2059, gfdl_esm2g, Jun Anomaly, NPL
2.46016, 2040-2059, gfdl_esm2g, Jul Anomaly, NPL
3.525, 2040-2059, gfdl_esm2g, Aug Anomaly, NPL
3.8168, 2040-2059, gfdl_esm2g, Sep Anomaly, NPL
2.98499, 2040-2059, gfdl_esm2g, Oct Anomaly, NPL
2.88228, 2040-2059, gfdl_esm2g, Nov Anomaly, NPL
5.07774, 2040-2059, gfdl_esm2g, Dec Anomaly, NPL
2.7074, 2040-2059, gfdl_esm2m, Jan Anomaly, NPL
1.10125, 2040-2059, gfdl_esm2m, Feb Anomaly, NPL
1.59566, 2040-2059, gfdl_esm2m, Mar Anomaly, NPL
2.3323, 2040-2059, gfdl_esm2m, Apr Anomaly, NPL
3.40233, 2040-2059, gfdl_esm2m, May Anomaly, NPL
2.61011, 2040-2059, gfdl_esm2m, Jun Anomaly, NPL
2.5284, 2040-2059, gfdl_esm2m, Jul Anomaly, NPL
6.34852, 2040-2059, gfdl_esm2m, Aug Anomaly, NPL
5.82124, 2040-2059, gfdl_esm2m, Sep Anomaly, NPL
3.41567, 2040-2059, gfdl_esm2m, Oct Anomaly, NPL
4.07501, 2040-2059, gfdl_esm2m, Nov Anomaly, NPL
1.70299, 2040-2059, gfdl_esm2m, Dec Anomaly, NPL
0.56302, 2040-2059, hadgem2_ao, Jan Anomaly, NPL
0.26531, 2040-2059, hadgem2_ao, Feb Anomaly, NPL
0.86951, 2040-2059, hadgem2_ao, Mar Anomaly, NPL
1.30118, 2040-2059, hadgem2_ao, Apr Anomaly, NPL
1.17628, 2040-2059, hadgem2_ao, May Anomaly, NPL
1.37052, 2040-2059, hadgem2_ao, Jun Anomaly, NPL
-0.0665, 2040-2059, hadgem2_ao, Jul Anomaly, NPL
0.6065, 2040-2059, hadgem2_ao, Aug Anomaly, NPL
1.46094, 2040-2059, hadgem2_ao, Sep Anomaly, NPL
2.84518, 2040-2059, hadgem2_ao, Oct Anomaly, NPL
5.26712, 2040-2059, hadgem2_ao, Nov Anomaly, NPL
3.71587, 2040-2059, hadgem2_ao, Dec Anomaly, NPL
3.84886, 2040-2059, hadgem2_cc, Jan Anomaly, NPL
3.6621, 2040-2059, hadgem2_cc, Feb Anomaly, NPL
2.10651, 2040-2059, hadgem2_cc, Mar Anomaly, NPL
1.20779, 2040-2059, hadgem2_cc, Apr Anomaly, NPL
3.66617, 2040-2059, hadgem2_cc, May Anomaly, NPL
4.67119, 2040-2059, hadgem2_cc, Jun Anomaly, NPL
0.54743, 2040-2059, hadgem2_cc, Jul Anomaly, NPL
1.68079, 2040-2059, hadgem2_cc, Aug Anomaly, NPL
5.56235, 2040-2059, hadgem2_cc, Sep Anomaly, NPL
10.6949, 2040-2059, hadgem2_cc, Oct Anomaly, NPL
13.4567, 2040-2059, hadgem2_cc, Nov Anomaly, NPL
6.05947, 2040-2059, hadgem2_cc, Dec Anomaly, NPL
3.63887, 2040-2059, hadgem2_es, Jan Anomaly, NPL
0.87622, 2040-2059, hadgem2_es, Feb Anomaly, NPL
1.39973, 2040-2059, hadgem2_es, Mar Anomaly, NPL
2.36872, 2040-2059, hadgem2_es, Apr Anomaly, NPL
-0.0335, 2040-2059, hadgem2_es, May Anomaly, NPL
3.69736, 2040-2059, hadgem2_es, Jun Anomaly, NPL
1.5823, 2040-2059, hadgem2_es, Jul Anomaly, NPL
1.73685, 2040-2059, hadgem2_es, Aug Anomaly, NPL
7.26593, 2040-2059, hadgem2_es, Sep Anomaly, NPL
13.5518, 2040-2059, hadgem2_es, Oct Anomaly, NPL
9.19236, 2040-2059, hadgem2_es, Nov Anomaly, NPL
2.49603, 2040-2059, hadgem2_es, Dec Anomaly, NPL
1.27378, 2040-2059, inmcm4, Jan Anomaly, NPL
-0.018, 2040-2059, inmcm4, Feb Anomaly, NPL
0.16494, 2040-2059, inmcm4, Mar Anomaly, NPL
0.22736, 2040-2059, inmcm4, Apr Anomaly, NPL
0.78884, 2040-2059, inmcm4, May Anomaly, NPL
0.93801, 2040-2059, inmcm4, Jun Anomaly, NPL
3.59539, 2040-2059, inmcm4, Jul Anomaly, NPL
11.4232, 2040-2059, inmcm4, Aug Anomaly, NPL
6.23911, 2040-2059, inmcm4, Sep Anomaly, NPL
3.12841, 2040-2059, inmcm4, Oct Anomaly, NPL
0.42864, 2040-2059, inmcm4, Nov Anomaly, NPL
0.90827, 2040-2059, inmcm4, Dec Anomaly, NPL
9.88533, 2040-2059, ipsl_cm5a_lr, Jan Anomaly, NPL
4.86126, 2040-2059, ipsl_cm5a_lr, Feb Anomaly, NPL
3.90035, 2040-2059, ipsl_cm5a_lr, Mar Anomaly, NPL
6.41956, 2040-2059, ipsl_cm5a_lr, Apr Anomaly, NPL
8.6583, 2040-2059, ipsl_cm5a_lr, May Anomaly, NPL
10.5081, 2040-2059, ipsl_cm5a_lr, Jun Anomaly, NPL
12.4826, 2040-2059, ipsl_cm5a_lr, Jul Anomaly, NPL
4.06107, 2040-2059, ipsl_cm5a_lr, Aug Anomaly, NPL
3.81812, 2040-2059, ipsl_cm5a_lr, Sep Anomaly, NPL
5.4482, 2040-2059, ipsl_cm5a_lr, Oct Anomaly, NPL
11.3151, 2040-2059, ipsl_cm5a_lr, Nov Anomaly, NPL
12.0562, 2040-2059, ipsl_cm5a_lr, Dec Anomaly, NPL
4.3614, 2040-2059, ipsl_cm5a_mr, Jan Anomaly, NPL
4.8178, 2040-2059, ipsl_cm5a_mr, Feb Anomaly, NPL
3.31575, 2040-2059, ipsl_cm5a_mr, Mar Anomaly, NPL
7.8496, 2040-2059, ipsl_cm5a_mr, Apr Anomaly, NPL
5.34769, 2040-2059, ipsl_cm5a_mr, May Anomaly, NPL
4.73266, 2040-2059, ipsl_cm5a_mr, Jun Anomaly, NPL
6.73937, 2040-2059, ipsl_cm5a_mr, Jul Anomaly, NPL
3.52453, 2040-2059, ipsl_cm5a_mr, Aug Anomaly, NPL
4.83896, 2040-2059, ipsl_cm5a_mr, Sep Anomaly, NPL
11.0922, 2040-2059, ipsl_cm5a_mr, Oct Anomaly, NPL
9.02185, 2040-2059, ipsl_cm5a_mr, Nov Anomaly, NPL
5.70525, 2040-2059, ipsl_cm5a_mr, Dec Anomaly, NPL
0.42808, 2040-2059, ipsl_cm5b_lr, Jan Anomaly, NPL
0.67467, 2040-2059, ipsl_cm5b_lr, Feb Anomaly, NPL
0.31745, 2040-2059, ipsl_cm5b_lr, Mar Anomaly, NPL
1.82841, 2040-2059, ipsl_cm5b_lr, Apr Anomaly, NPL
3.47767, 2040-2059, ipsl_cm5b_lr, May Anomaly, NPL
3.94474, 2040-2059, ipsl_cm5b_lr, Jun Anomaly, NPL
8.28529, 2040-2059, ipsl_cm5b_lr, Jul Anomaly, NPL
4.76557, 2040-2059, ipsl_cm5b_lr, Aug Anomaly, NPL
5.36868, 2040-2059, ipsl_cm5b_lr, Sep Anomaly, NPL
6.57153, 2040-2059, ipsl_cm5b_lr, Oct Anomaly, NPL
2.59972, 2040-2059, ipsl_cm5b_lr, Nov Anomaly, NPL
1.47049, 2040-2059, ipsl_cm5b_lr, Dec Anomaly, NPL
1.7917, 2040-2059, mpi_esm_lr, Jan Anomaly, NPL
4.67305, 2040-2059, mpi_esm_lr, Feb Anomaly, NPL
4.24056, 2040-2059, mpi_esm_lr, Mar Anomaly, NPL
7.97281, 2040-2059, mpi_esm_lr, Apr Anomaly, NPL
4.61343, 2040-2059, mpi_esm_lr, May Anomaly, NPL
4.37529, 2040-2059, mpi_esm_lr, Jun Anomaly, NPL
3.30128, 2040-2059, mpi_esm_lr, Jul Anomaly, NPL
2.37713, 2040-2059, mpi_esm_lr, Aug Anomaly, NPL
4.47767, 2040-2059, mpi_esm_lr, Sep Anomaly, NPL
6.95103, 2040-2059, mpi_esm_lr, Oct Anomaly, NPL
4.86797, 2040-2059, mpi_esm_lr, Nov Anomaly, NPL
4.44368, 2040-2059, mpi_esm_lr, Dec Anomaly, NPL
3.57041, 2040-2059, mpi_esm_mr, Jan Anomaly, NPL
0.99432, 2040-2059, mpi_esm_mr, Feb Anomaly, NPL
1.8572, 2040-2059, mpi_esm_mr, Mar Anomaly, NPL
4.47393, 2040-2059, mpi_esm_mr, Apr Anomaly, NPL
5.25663, 2040-2059, mpi_esm_mr, May Anomaly, NPL
5.72016, 2040-2059, mpi_esm_mr, Jun Anomaly, NPL
3.16645, 2040-2059, mpi_esm_mr, Jul Anomaly, NPL
3.19326, 2040-2059, mpi_esm_mr, Aug Anomaly, NPL
2.95877, 2040-2059, mpi_esm_mr, Sep Anomaly, NPL
5.74438, 2040-2059, mpi_esm_mr, Oct Anomaly, NPL
5.00664, 2040-2059, mpi_esm_mr, Nov Anomaly, NPL
4.76201, 2040-2059, mpi_esm_mr, Dec Anomaly, NPL
2.855, 2040-2059, noresm1_m, Jan Anomaly, NPL
3.38987, 2040-2059, noresm1_m, Feb Anomaly, NPL
4.18422, 2040-2059, noresm1_m, Mar Anomaly, NPL
7.9415, 2040-2059, noresm1_m, Apr Anomaly, NPL
4.1862, 2040-2059, noresm1_m, May Anomaly, NPL
2.46499, 2040-2059, noresm1_m, Jun Anomaly, NPL
0.58268, 2040-2059, noresm1_m, Jul Anomaly, NPL
0.26847, 2040-2059, noresm1_m, Aug Anomaly, NPL
1.20725, 2040-2059, noresm1_m, Sep Anomaly, NPL
4.03446, 2040-2059, noresm1_m, Oct Anomaly, NPL
3.8747, 2040-2059, noresm1_m, Nov Anomaly, NPL
3.30827, 2040-2059, noresm1_m, Dec Anomaly, NPL
0.98898, 2040-2059, Ensemble (10th Percentile), Jan Anomaly, NPL
0.22393, 2040-2059, Ensemble (10th Percentile), Feb Anomaly, NPL
0.66311, 2040-2059, Ensemble (10th Percentile), Mar Anomaly, NPL
1.03616, 2040-2059, Ensemble (10th Percentile), Apr Anomaly, NPL
0.92337, 2040-2059, Ensemble (10th Percentile), May Anomaly, NPL
1.45836, 2040-2059, Ensemble (10th Percentile), Jun Anomaly, NPL
0.09677, 2040-2059, Ensemble (10th Percentile), Jul Anomaly, NPL
0.26724, 2040-2059, Ensemble (10th Percentile), Aug Anomaly, NPL
0.66386, 2040-2059, Ensemble (10th Percentile), Sep Anomaly, NPL
1.49509, 2040-2059, Ensemble (10th Percentile), Oct Anomaly, NPL
1.67033, 2040-2059, Ensemble (10th Percentile), Nov Anomaly, NPL
0.96532, 2040-2059, Ensemble (10th Percentile), Dec Anomaly, NPL
3.38337, 2040-2059, Ensemble (50th Percentile), Jan Anomaly, NPL
2.45402, 2040-2059, Ensemble (50th Percentile), Feb Anomaly, NPL
2.7641, 2040-2059, Ensemble (50th Percentile), Mar Anomaly, NPL
4.47665, 2040-2059, Ensemble (50th Percentile), Apr Anomaly, NPL
5.01136, 2040-2059, Ensemble (50th Percentile), May Anomaly, NPL
3.81972, 2040-2059, Ensemble (50th Percentile), Jun Anomaly, NPL
2.42459, 2040-2059, Ensemble (50th Percentile), Jul Anomaly, NPL
1.83845, 2040-2059, Ensemble (50th Percentile), Aug Anomaly, NPL
2.92037, 2040-2059, Ensemble (50th Percentile), Sep Anomaly, NPL
4.15068, 2040-2059, Ensemble (50th Percentile), Oct Anomaly, NPL
4.27523, 2040-2059, Ensemble (50th Percentile), Nov Anomaly, NPL
4.23187, 2040-2059, Ensemble (50th Percentile), Dec Anomaly, NPL
9.3411, 2040-2059, Ensemble (90th Percentile), Jan Anomaly, NPL
6.41695, 2040-2059, Ensemble (90th Percentile), Feb Anomaly, NPL
6.42861, 2040-2059, Ensemble (90th Percentile), Mar Anomaly, NPL
8.4583, 2040-2059, Ensemble (90th Percentile), Apr Anomaly, NPL
9.37682, 2040-2059, Ensemble (90th Percentile), May Anomaly, NPL
8.87765, 2040-2059, Ensemble (90th Percentile), Jun Anomaly, NPL
8.77235, 2040-2059, Ensemble (90th Percentile), Jul Anomaly, NPL
7.3391, 2040-2059, Ensemble (90th Percentile), Aug Anomaly, NPL
7.97283, 2040-2059, Ensemble (90th Percentile), Sep Anomaly, NPL
11.4077, 2040-2059, Ensemble (90th Percentile), Oct Anomaly, NPL
11.2404, 2040-2059, Ensemble (90th Percentile), Nov Anomaly, NPL
9.47997, 2040-2059, Ensemble (90th Percentile), Dec Anomaly, NPL
59.1975, 2040-2059, access1_0, Annual Anomaly, NPL
46.8442, 2040-2059, access1_3, Annual Anomaly, NPL
34.0449, 2040-2059, bcc_csm1_1_m, Annual Anomaly, NPL
35.2773, 2040-2059, bcc_csm1_1, Annual Anomaly, NPL
50.6711, 2040-2059, bnu_esm, Annual Anomaly, NPL
48.861, 2040-2059, canesm2, Annual Anomaly, NPL
38.7557, 2040-2059, ccsm4, Annual Anomaly, NPL
30.1257, 2040-2059, cesm1_bgc, Annual Anomaly, NPL
34.2446, 2040-2059, cesm1_cam5, Annual Anomaly, NPL
50.9958, 2040-2059, cmcc_cm, Annual Anomaly, NPL
61.7167, 2040-2059, cmcc_cms, Annual Anomaly, NPL
36.7202, 2040-2059, cnrm_cm5, Annual Anomaly, NPL
60.2222, 2040-2059, csiro_mk3_6_0, Annual Anomaly, NPL
109.385, 2040-2059, gfdl_cm3, Annual Anomaly, NPL
39.589, 2040-2059, gfdl_esm2g, Annual Anomaly, NPL
37.6409, 2040-2059, gfdl_esm2m, Annual Anomaly, NPL
18.4791, 2040-2059, hadgem2_ao, Annual Anomaly, NPL
54.6256, 2040-2059, hadgem2_cc, Annual Anomaly, NPL
45.6711, 2040-2059, hadgem2_es, Annual Anomaly, NPL
29.0979, 2040-2059, inmcm4, Annual Anomaly, NPL
93.4145, 2040-2059, ipsl_cm5a_lr, Annual Anomaly, NPL
71.3471, 2040-2059, ipsl_cm5a_mr, Annual Anomaly, NPL
39.7323, 2040-2059, ipsl_cm5b_lr, Annual Anomaly, NPL
54.0976, 2040-2059, mpi_esm_lr, Annual Anomaly, NPL
46.7001, 2040-2059, mpi_esm_mr, Annual Anomaly, NPL
38.2976, 2040-2059, noresm1_m, Annual Anomaly, NPL
28.1893, 2040-2059, Ensemble (10th Percentile), Annual Anomaly, NPL
45.3068, 2040-2059, Ensemble (50th Percentile), Annual Anomaly, NPL
77.9664, 2040-2059, Ensemble (90th Percentile), Annual Anomaly, NPL
