Warm Spell Duration Index - (Days), Year, Model, Statistics, ISO3
0.63273, 2020-2039, bcc_csm1_1_m, Jan Anomaly, NPL
-0.1013, 2020-2039, bcc_csm1_1_m, Feb Anomaly, NPL
1.356, 2020-2039, bcc_csm1_1_m, Mar Anomaly, NPL
2.50334, 2020-2039, bcc_csm1_1_m, Apr Anomaly, NPL
1.94423, 2020-2039, bcc_csm1_1_m, May Anomaly, NPL
0.57854, 2020-2039, bcc_csm1_1_m, Jun Anomaly, NPL
0.1257, 2020-2039, bcc_csm1_1_m, Jul Anomaly, NPL
1.11599, 2020-2039, bcc_csm1_1_m, Aug Anomaly, NPL
0.14883, 2020-2039, bcc_csm1_1_m, Sep Anomaly, NPL
1.36219, 2020-2039, bcc_csm1_1_m, Oct Anomaly, NPL
2.57479, 2020-2039, bcc_csm1_1_m, Nov Anomaly, NPL
0.3155, 2020-2039, bcc_csm1_1_m, Dec Anomaly, NPL
0.92013, 2020-2039, ccsm4, Jan Anomaly, NPL
0.72458, 2020-2039, ccsm4, Feb Anomaly, NPL
2.2374, 2020-2039, ccsm4, Mar Anomaly, NPL
1.86945, 2020-2039, ccsm4, Apr Anomaly, NPL
3.36255, 2020-2039, ccsm4, May Anomaly, NPL
2.11397, 2020-2039, ccsm4, Jun Anomaly, NPL
1.16242, 2020-2039, ccsm4, Jul Anomaly, NPL
0.20321, 2020-2039, ccsm4, Aug Anomaly, NPL
0.20317, 2020-2039, ccsm4, Sep Anomaly, NPL
0.94916, 2020-2039, ccsm4, Oct Anomaly, NPL
1.3174, 2020-2039, ccsm4, Nov Anomaly, NPL
0.1707, 2020-2039, ccsm4, Dec Anomaly, NPL
0.63551, 2020-2039, cesm1_cam5, Jan Anomaly, NPL
0.48629, 2020-2039, cesm1_cam5, Feb Anomaly, NPL
0.20736, 2020-2039, cesm1_cam5, Mar Anomaly, NPL
1.44779, 2020-2039, cesm1_cam5, Apr Anomaly, NPL
1.85453, 2020-2039, cesm1_cam5, May Anomaly, NPL
0.55582, 2020-2039, cesm1_cam5, Jun Anomaly, NPL
-0.0716, 2020-2039, cesm1_cam5, Jul Anomaly, NPL
0.15111, 2020-2039, cesm1_cam5, Aug Anomaly, NPL
0.47058, 2020-2039, cesm1_cam5, Sep Anomaly, NPL
0.47345, 2020-2039, cesm1_cam5, Oct Anomaly, NPL
0.60762, 2020-2039, cesm1_cam5, Nov Anomaly, NPL
0.3195, 2020-2039, cesm1_cam5, Dec Anomaly, NPL
-0.2343, 2020-2039, csiro_mk3_6_0, Jan Anomaly, NPL
1.20402, 2020-2039, csiro_mk3_6_0, Feb Anomaly, NPL
0.90802, 2020-2039, csiro_mk3_6_0, Mar Anomaly, NPL
0.75945, 2020-2039, csiro_mk3_6_0, Apr Anomaly, NPL
1.11513, 2020-2039, csiro_mk3_6_0, May Anomaly, NPL
0.90094, 2020-2039, csiro_mk3_6_0, Jun Anomaly, NPL
2.13175, 2020-2039, csiro_mk3_6_0, Jul Anomaly, NPL
1.253, 2020-2039, csiro_mk3_6_0, Aug Anomaly, NPL
0.13008, 2020-2039, csiro_mk3_6_0, Sep Anomaly, NPL
0.42886, 2020-2039, csiro_mk3_6_0, Oct Anomaly, NPL
0.28833, 2020-2039, csiro_mk3_6_0, Nov Anomaly, NPL
2.9415, 2020-2039, csiro_mk3_6_0, Dec Anomaly, NPL
1.59632, 2020-2039, gfdl_cm3, Jan Anomaly, NPL
1.32206, 2020-2039, gfdl_cm3, Feb Anomaly, NPL
0.92126, 2020-2039, gfdl_cm3, Mar Anomaly, NPL
0.7161, 2020-2039, gfdl_cm3, Apr Anomaly, NPL
2.23744, 2020-2039, gfdl_cm3, May Anomaly, NPL
2.40812, 2020-2039, gfdl_cm3, Jun Anomaly, NPL
2.63522, 2020-2039, gfdl_cm3, Jul Anomaly, NPL
5.20619, 2020-2039, gfdl_cm3, Aug Anomaly, NPL
2.839, 2020-2039, gfdl_cm3, Sep Anomaly, NPL
2.6225, 2020-2039, gfdl_cm3, Oct Anomaly, NPL
1.58256, 2020-2039, gfdl_cm3, Nov Anomaly, NPL
5.41386, 2020-2039, gfdl_cm3, Dec Anomaly, NPL
-0.0514, 2020-2039, gfdl_esm2g, Jan Anomaly, NPL
-0.0473, 2020-2039, gfdl_esm2g, Feb Anomaly, NPL
0.87023, 2020-2039, gfdl_esm2g, Mar Anomaly, NPL
1.35911, 2020-2039, gfdl_esm2g, Apr Anomaly, NPL
1.0319, 2020-2039, gfdl_esm2g, May Anomaly, NPL
1.01943, 2020-2039, gfdl_esm2g, Jun Anomaly, NPL
0.08311, 2020-2039, gfdl_esm2g, Jul Anomaly, NPL
1.69839, 2020-2039, gfdl_esm2g, Aug Anomaly, NPL
0.69946, 2020-2039, gfdl_esm2g, Sep Anomaly, NPL
2.09729, 2020-2039, gfdl_esm2g, Oct Anomaly, NPL
1.85614, 2020-2039, gfdl_esm2g, Nov Anomaly, NPL
0.83735, 2020-2039, gfdl_esm2g, Dec Anomaly, NPL
0.90401, 2020-2039, gfdl_esm2m, Jan Anomaly, NPL
0.13842, 2020-2039, gfdl_esm2m, Feb Anomaly, NPL
0.57545, 2020-2039, gfdl_esm2m, Mar Anomaly, NPL
0.87044, 2020-2039, gfdl_esm2m, Apr Anomaly, NPL
1.21552, 2020-2039, gfdl_esm2m, May Anomaly, NPL
0.96033, 2020-2039, gfdl_esm2m, Jun Anomaly, NPL
2.37943, 2020-2039, gfdl_esm2m, Jul Anomaly, NPL
2.90711, 2020-2039, gfdl_esm2m, Aug Anomaly, NPL
1.36264, 2020-2039, gfdl_esm2m, Sep Anomaly, NPL
1.0216, 2020-2039, gfdl_esm2m, Oct Anomaly, NPL
1.04219, 2020-2039, gfdl_esm2m, Nov Anomaly, NPL
0.20812, 2020-2039, gfdl_esm2m, Dec Anomaly, NPL
0.12923, 2020-2039, hadgem2_ao, Jan Anomaly, NPL
0.03196, 2020-2039, hadgem2_ao, Feb Anomaly, NPL
0.04881, 2020-2039, hadgem2_ao, Mar Anomaly, NPL
0.19922, 2020-2039, hadgem2_ao, Apr Anomaly, NPL
0.46409, 2020-2039, hadgem2_ao, May Anomaly, NPL
-0.0257, 2020-2039, hadgem2_ao, Jun Anomaly, NPL
-0.1363, 2020-2039, hadgem2_ao, Jul Anomaly, NPL
0.01031, 2020-2039, hadgem2_ao, Aug Anomaly, NPL
0.09207, 2020-2039, hadgem2_ao, Sep Anomaly, NPL
0.44989, 2020-2039, hadgem2_ao, Oct Anomaly, NPL
0.96779, 2020-2039, hadgem2_ao, Nov Anomaly, NPL
0.59978, 2020-2039, hadgem2_ao, Dec Anomaly, NPL
1.14396, 2020-2039, hadgem2_es, Jan Anomaly, NPL
0.19515, 2020-2039, hadgem2_es, Feb Anomaly, NPL
0.01241, 2020-2039, hadgem2_es, Mar Anomaly, NPL
0.57811, 2020-2039, hadgem2_es, Apr Anomaly, NPL
-0.4273, 2020-2039, hadgem2_es, May Anomaly, NPL
0.66516, 2020-2039, hadgem2_es, Jun Anomaly, NPL
0.07594, 2020-2039, hadgem2_es, Jul Anomaly, NPL
0.79191, 2020-2039, hadgem2_es, Aug Anomaly, NPL
2.09508, 2020-2039, hadgem2_es, Sep Anomaly, NPL
2.68231, 2020-2039, hadgem2_es, Oct Anomaly, NPL
2.5008, 2020-2039, hadgem2_es, Nov Anomaly, NPL
0.09882, 2020-2039, hadgem2_es, Dec Anomaly, NPL
4.08523, 2020-2039, ipsl_cm5a_lr, Jan Anomaly, NPL
1.42798, 2020-2039, ipsl_cm5a_lr, Feb Anomaly, NPL
2.00017, 2020-2039, ipsl_cm5a_lr, Mar Anomaly, NPL
3.50591, 2020-2039, ipsl_cm5a_lr, Apr Anomaly, NPL
3.03804, 2020-2039, ipsl_cm5a_lr, May Anomaly, NPL
2.88292, 2020-2039, ipsl_cm5a_lr, Jun Anomaly, NPL
3.98067, 2020-2039, ipsl_cm5a_lr, Jul Anomaly, NPL
2.18445, 2020-2039, ipsl_cm5a_lr, Aug Anomaly, NPL
0.88275, 2020-2039, ipsl_cm5a_lr, Sep Anomaly, NPL
1.77652, 2020-2039, ipsl_cm5a_lr, Oct Anomaly, NPL
3.71939, 2020-2039, ipsl_cm5a_lr, Nov Anomaly, NPL
0.86838, 2020-2039, ipsl_cm5a_lr, Dec Anomaly, NPL
1.34348, 2020-2039, ipsl_cm5a_mr, Jan Anomaly, NPL
2.30837, 2020-2039, ipsl_cm5a_mr, Feb Anomaly, NPL
0.64415, 2020-2039, ipsl_cm5a_mr, Mar Anomaly, NPL
1.13775, 2020-2039, ipsl_cm5a_mr, Apr Anomaly, NPL
0.43221, 2020-2039, ipsl_cm5a_mr, May Anomaly, NPL
1.40467, 2020-2039, ipsl_cm5a_mr, Jun Anomaly, NPL
2.18111, 2020-2039, ipsl_cm5a_mr, Jul Anomaly, NPL
1.38914, 2020-2039, ipsl_cm5a_mr, Aug Anomaly, NPL
1.45995, 2020-2039, ipsl_cm5a_mr, Sep Anomaly, NPL
2.16699, 2020-2039, ipsl_cm5a_mr, Oct Anomaly, NPL
1.11929, 2020-2039, ipsl_cm5a_mr, Nov Anomaly, NPL
1.07871, 2020-2039, ipsl_cm5a_mr, Dec Anomaly, NPL
-0.095, 2020-2039, miroc_esm, Jan Anomaly, NPL
0.15294, 2020-2039, miroc_esm, Feb Anomaly, NPL
0.48829, 2020-2039, miroc_esm, Mar Anomaly, NPL
0.02524, 2020-2039, miroc_esm, Apr Anomaly, NPL
0.11088, 2020-2039, miroc_esm, May Anomaly, NPL
0.14808, 2020-2039, miroc_esm, Jun Anomaly, NPL
0.48319, 2020-2039, miroc_esm, Jul Anomaly, NPL
-0.1208, 2020-2039, miroc_esm, Aug Anomaly, NPL
0.22032, 2020-2039, miroc_esm, Sep Anomaly, NPL
0.64483, 2020-2039, miroc_esm, Oct Anomaly, NPL
0.29721, 2020-2039, miroc_esm, Nov Anomaly, NPL
-0.1344, 2020-2039, miroc_esm, Dec Anomaly, NPL
0.09674, 2020-2039, noresm1_m, Jan Anomaly, NPL
-0.0878, 2020-2039, noresm1_m, Feb Anomaly, NPL
1.37141, 2020-2039, noresm1_m, Mar Anomaly, NPL
1.91187, 2020-2039, noresm1_m, Apr Anomaly, NPL
1.1275, 2020-2039, noresm1_m, May Anomaly, NPL
1.27028, 2020-2039, noresm1_m, Jun Anomaly, NPL
0.57458, 2020-2039, noresm1_m, Jul Anomaly, NPL
-0.1221, 2020-2039, noresm1_m, Aug Anomaly, NPL
0.74402, 2020-2039, noresm1_m, Sep Anomaly, NPL
0.10865, 2020-2039, noresm1_m, Oct Anomaly, NPL
2.13371, 2020-2039, noresm1_m, Nov Anomaly, NPL
-0.1439, 2020-2039, noresm1_m, Dec Anomaly, NPL
-0.091, 2020-2039, Ensemble (10th Percentile), Jan Anomaly, NPL
-0.2335, 2020-2039, Ensemble (10th Percentile), Feb Anomaly, NPL
-0.0856, 2020-2039, Ensemble (10th Percentile), Mar Anomaly, NPL
0.10792, 2020-2039, Ensemble (10th Percentile), Apr Anomaly, NPL
-0.1451, 2020-2039, Ensemble (10th Percentile), May Anomaly, NPL
-0.1536, 2020-2039, Ensemble (10th Percentile), Jun Anomaly, NPL
-0.2198, 2020-2039, Ensemble (10th Percentile), Jul Anomaly, NPL
-0.1093, 2020-2039, Ensemble (10th Percentile), Aug Anomaly, NPL
-0.0319, 2020-2039, Ensemble (10th Percentile), Sep Anomaly, NPL
-0.1079, 2020-2039, Ensemble (10th Percentile), Oct Anomaly, NPL
0.06318, 2020-2039, Ensemble (10th Percentile), Nov Anomaly, NPL
-0.0858, 2020-2039, Ensemble (10th Percentile), Dec Anomaly, NPL
0.75286, 2020-2039, Ensemble (50th Percentile), Jan Anomaly, NPL
0.34718, 2020-2039, Ensemble (50th Percentile), Feb Anomaly, NPL
0.77658, 2020-2039, Ensemble (50th Percentile), Mar Anomaly, NPL
0.99612, 2020-2039, Ensemble (50th Percentile), Apr Anomaly, NPL
1.21585, 2020-2039, Ensemble (50th Percentile), May Anomaly, NPL
0.8633, 2020-2039, Ensemble (50th Percentile), Jun Anomaly, NPL
0.63743, 2020-2039, Ensemble (50th Percentile), Jul Anomaly, NPL
0.56586, 2020-2039, Ensemble (50th Percentile), Aug Anomaly, NPL
0.51214, 2020-2039, Ensemble (50th Percentile), Sep Anomaly, NPL
0.89131, 2020-2039, Ensemble (50th Percentile), Oct Anomaly, NPL
1.2397, 2020-2039, Ensemble (50th Percentile), Nov Anomaly, NPL
0.60271, 2020-2039, Ensemble (50th Percentile), Dec Anomaly, NPL
3.69628, 2020-2039, Ensemble (90th Percentile), Jan Anomaly, NPL
2.29777, 2020-2039, Ensemble (90th Percentile), Feb Anomaly, NPL
2.25881, 2020-2039, Ensemble (90th Percentile), Mar Anomaly, NPL
3.00888, 2020-2039, Ensemble (90th Percentile), Apr Anomaly, NPL
3.79925, 2020-2039, Ensemble (90th Percentile), May Anomaly, NPL
3.19775, 2020-2039, Ensemble (90th Percentile), Jun Anomaly, NPL
4.21198, 2020-2039, Ensemble (90th Percentile), Jul Anomaly, NPL
4.15941, 2020-2039, Ensemble (90th Percentile), Aug Anomaly, NPL
2.48488, 2020-2039, Ensemble (90th Percentile), Sep Anomaly, NPL
2.89317, 2020-2039, Ensemble (90th Percentile), Oct Anomaly, NPL
3.38552, 2020-2039, Ensemble (90th Percentile), Nov Anomaly, NPL
3.7691, 2020-2039, Ensemble (90th Percentile), Dec Anomaly, NPL
12.5565, 2020-2039, bcc_csm1_1_m, Annual Anomaly, NPL
15.2341, 2020-2039, ccsm4, Annual Anomaly, NPL
7.13792, 2020-2039, cesm1_cam5, Annual Anomaly, NPL
11.8267, 2020-2039, csiro_mk3_6_0, Annual Anomaly, NPL
29.5006, 2020-2039, gfdl_cm3, Annual Anomaly, NPL
11.4536, 2020-2039, gfdl_esm2g, Annual Anomaly, NPL
13.5853, 2020-2039, gfdl_esm2m, Annual Anomaly, NPL
2.70237, 2020-2039, hadgem2_ao, Annual Anomaly, NPL
9.97099, 2020-2039, hadgem2_es, Annual Anomaly, NPL
30.3524, 2020-2039, ipsl_cm5a_lr, Annual Anomaly, NPL
16.6658, 2020-2039, ipsl_cm5a_mr, Annual Anomaly, NPL
2.22659, 2020-2039, miroc_esm, Annual Anomaly, NPL
8.9849, 2020-2039, noresm1_m, Annual Anomaly, NPL
1.08044, 2020-2039, Ensemble (10th Percentile), Annual Anomaly, NPL
11.5366, 2020-2039, Ensemble (50th Percentile), Annual Anomaly, NPL
29.6594, 2020-2039, Ensemble (90th Percentile), Annual Anomaly, NPL
