Minimum of Daily Min-Temperature - (Celsius), Year, Model, Statistics, ISO3
2.45108, 2040-2059, bcc_csm1_1_m, Jan Anomaly, NPL
1.87404, 2040-2059, bcc_csm1_1_m, Feb Anomaly, NPL
1.18348, 2040-2059, bcc_csm1_1_m, Mar Anomaly, NPL
2.06732, 2040-2059, bcc_csm1_1_m, Apr Anomaly, NPL
2.12444, 2040-2059, bcc_csm1_1_m, May Anomaly, NPL
1.43374, 2040-2059, bcc_csm1_1_m, Jun Anomaly, NPL
1.30414, 2040-2059, bcc_csm1_1_m, Jul Anomaly, NPL
1.22953, 2040-2059, bcc_csm1_1_m, Aug Anomaly, NPL
0.667, 2040-2059, bcc_csm1_1_m, Sep Anomaly, NPL
1.67025, 2040-2059, bcc_csm1_1_m, Oct Anomaly, NPL
2.65791, 2040-2059, bcc_csm1_1_m, Nov Anomaly, NPL
2.16367, 2040-2059, bcc_csm1_1_m, Dec Anomaly, NPL
2.08211, 2040-2059, bcc_csm1_1, Jan Anomaly, NPL
1.36303, 2040-2059, bcc_csm1_1, Feb Anomaly, NPL
0.43345, 2040-2059, bcc_csm1_1, Mar Anomaly, NPL
0.58236, 2040-2059, bcc_csm1_1, Apr Anomaly, NPL
1.59725, 2040-2059, bcc_csm1_1, May Anomaly, NPL
0.83426, 2040-2059, bcc_csm1_1, Jun Anomaly, NPL
0.80932, 2040-2059, bcc_csm1_1, Jul Anomaly, NPL
1.31915, 2040-2059, bcc_csm1_1, Aug Anomaly, NPL
1.33951, 2040-2059, bcc_csm1_1, Sep Anomaly, NPL
1.35483, 2040-2059, bcc_csm1_1, Oct Anomaly, NPL
0.84705, 2040-2059, bcc_csm1_1, Nov Anomaly, NPL
1.12813, 2040-2059, bcc_csm1_1, Dec Anomaly, NPL
2.17099, 2040-2059, ccsm4, Jan Anomaly, NPL
1.43125, 2040-2059, ccsm4, Feb Anomaly, NPL
1.95691, 2040-2059, ccsm4, Mar Anomaly, NPL
2.74784, 2040-2059, ccsm4, Apr Anomaly, NPL
2.86128, 2040-2059, ccsm4, May Anomaly, NPL
2.47039, 2040-2059, ccsm4, Jun Anomaly, NPL
1.65165, 2040-2059, ccsm4, Jul Anomaly, NPL
1.9528, 2040-2059, ccsm4, Aug Anomaly, NPL
1.64976, 2040-2059, ccsm4, Sep Anomaly, NPL
2.34798, 2040-2059, ccsm4, Oct Anomaly, NPL
2.31505, 2040-2059, ccsm4, Nov Anomaly, NPL
2.49627, 2040-2059, ccsm4, Dec Anomaly, NPL
2.86803, 2040-2059, cesm1_cam5, Jan Anomaly, NPL
2.84897, 2040-2059, cesm1_cam5, Feb Anomaly, NPL
2.83045, 2040-2059, cesm1_cam5, Mar Anomaly, NPL
2.07906, 2040-2059, cesm1_cam5, Apr Anomaly, NPL
2.32462, 2040-2059, cesm1_cam5, May Anomaly, NPL
1.89038, 2040-2059, cesm1_cam5, Jun Anomaly, NPL
2.02856, 2040-2059, cesm1_cam5, Jul Anomaly, NPL
1.92378, 2040-2059, cesm1_cam5, Aug Anomaly, NPL
2.6463, 2040-2059, cesm1_cam5, Sep Anomaly, NPL
2.50787, 2040-2059, cesm1_cam5, Oct Anomaly, NPL
2.87977, 2040-2059, cesm1_cam5, Nov Anomaly, NPL
2.93046, 2040-2059, cesm1_cam5, Dec Anomaly, NPL
2.33589, 2040-2059, csiro_mk3_6_0, Jan Anomaly, NPL
2.3079, 2040-2059, csiro_mk3_6_0, Feb Anomaly, NPL
1.82515, 2040-2059, csiro_mk3_6_0, Mar Anomaly, NPL
2.56201, 2040-2059, csiro_mk3_6_0, Apr Anomaly, NPL
2.09215, 2040-2059, csiro_mk3_6_0, May Anomaly, NPL
2.08617, 2040-2059, csiro_mk3_6_0, Jun Anomaly, NPL
1.46146, 2040-2059, csiro_mk3_6_0, Jul Anomaly, NPL
1.28376, 2040-2059, csiro_mk3_6_0, Aug Anomaly, NPL
1.83014, 2040-2059, csiro_mk3_6_0, Sep Anomaly, NPL
1.65293, 2040-2059, csiro_mk3_6_0, Oct Anomaly, NPL
1.54041, 2040-2059, csiro_mk3_6_0, Nov Anomaly, NPL
1.97649, 2040-2059, csiro_mk3_6_0, Dec Anomaly, NPL
2.1691, 2040-2059, gfdl_cm3, Jan Anomaly, NPL
1.68218, 2040-2059, gfdl_cm3, Feb Anomaly, NPL
2.48426, 2040-2059, gfdl_cm3, Mar Anomaly, NPL
3.7973, 2040-2059, gfdl_cm3, Apr Anomaly, NPL
3.2961, 2040-2059, gfdl_cm3, May Anomaly, NPL
4.12815, 2040-2059, gfdl_cm3, Jun Anomaly, NPL
3.62383, 2040-2059, gfdl_cm3, Jul Anomaly, NPL
3.52418, 2040-2059, gfdl_cm3, Aug Anomaly, NPL
2.15796, 2040-2059, gfdl_cm3, Sep Anomaly, NPL
2.03722, 2040-2059, gfdl_cm3, Oct Anomaly, NPL
1.32606, 2040-2059, gfdl_cm3, Nov Anomaly, NPL
2.31288, 2040-2059, gfdl_cm3, Dec Anomaly, NPL
0.53335, 2040-2059, gfdl_esm2g, Jan Anomaly, NPL
0.33614, 2040-2059, gfdl_esm2g, Feb Anomaly, NPL
1.05414, 2040-2059, gfdl_esm2g, Mar Anomaly, NPL
1.61795, 2040-2059, gfdl_esm2g, Apr Anomaly, NPL
1.65609, 2040-2059, gfdl_esm2g, May Anomaly, NPL
1.28813, 2040-2059, gfdl_esm2g, Jun Anomaly, NPL
1.70527, 2040-2059, gfdl_esm2g, Jul Anomaly, NPL
0.529, 2040-2059, gfdl_esm2g, Aug Anomaly, NPL
1.50996, 2040-2059, gfdl_esm2g, Sep Anomaly, NPL
0.75318, 2040-2059, gfdl_esm2g, Oct Anomaly, NPL
0.81142, 2040-2059, gfdl_esm2g, Nov Anomaly, NPL
1.40435, 2040-2059, gfdl_esm2g, Dec Anomaly, NPL
0.8495, 2040-2059, gfdl_esm2m, Jan Anomaly, NPL
0.32241, 2040-2059, gfdl_esm2m, Feb Anomaly, NPL
0.81351, 2040-2059, gfdl_esm2m, Mar Anomaly, NPL
2.18542, 2040-2059, gfdl_esm2m, Apr Anomaly, NPL
2.25716, 2040-2059, gfdl_esm2m, May Anomaly, NPL
1.36004, 2040-2059, gfdl_esm2m, Jun Anomaly, NPL
1.25897, 2040-2059, gfdl_esm2m, Jul Anomaly, NPL
1.06105, 2040-2059, gfdl_esm2m, Aug Anomaly, NPL
2.22955, 2040-2059, gfdl_esm2m, Sep Anomaly, NPL
1.8143, 2040-2059, gfdl_esm2m, Oct Anomaly, NPL
1.50334, 2040-2059, gfdl_esm2m, Nov Anomaly, NPL
0.02666, 2040-2059, gfdl_esm2m, Dec Anomaly, NPL
1.21229, 2040-2059, hadgem2_ao, Jan Anomaly, NPL
1.39222, 2040-2059, hadgem2_ao, Feb Anomaly, NPL
1.68818, 2040-2059, hadgem2_ao, Mar Anomaly, NPL
1.7381, 2040-2059, hadgem2_ao, Apr Anomaly, NPL
1.4246, 2040-2059, hadgem2_ao, May Anomaly, NPL
0.95283, 2040-2059, hadgem2_ao, Jun Anomaly, NPL
0.64812, 2040-2059, hadgem2_ao, Jul Anomaly, NPL
0.61589, 2040-2059, hadgem2_ao, Aug Anomaly, NPL
1.25502, 2040-2059, hadgem2_ao, Sep Anomaly, NPL
0.67731, 2040-2059, hadgem2_ao, Oct Anomaly, NPL
1.53191, 2040-2059, hadgem2_ao, Nov Anomaly, NPL
2.05535, 2040-2059, hadgem2_ao, Dec Anomaly, NPL
1.7713, 2040-2059, hadgem2_es, Jan Anomaly, NPL
1.44095, 2040-2059, hadgem2_es, Feb Anomaly, NPL
2.33029, 2040-2059, hadgem2_es, Mar Anomaly, NPL
1.62234, 2040-2059, hadgem2_es, Apr Anomaly, NPL
1.48273, 2040-2059, hadgem2_es, May Anomaly, NPL
1.0563, 2040-2059, hadgem2_es, Jun Anomaly, NPL
1.36749, 2040-2059, hadgem2_es, Jul Anomaly, NPL
1.38878, 2040-2059, hadgem2_es, Aug Anomaly, NPL
1.44439, 2040-2059, hadgem2_es, Sep Anomaly, NPL
1.39833, 2040-2059, hadgem2_es, Oct Anomaly, NPL
1.22004, 2040-2059, hadgem2_es, Nov Anomaly, NPL
1.44895, 2040-2059, hadgem2_es, Dec Anomaly, NPL
0.9826, 2040-2059, ipsl_cm5a_lr, Jan Anomaly, NPL
1.9851, 2040-2059, ipsl_cm5a_lr, Feb Anomaly, NPL
2.73144, 2040-2059, ipsl_cm5a_lr, Mar Anomaly, NPL
2.05921, 2040-2059, ipsl_cm5a_lr, Apr Anomaly, NPL
1.56837, 2040-2059, ipsl_cm5a_lr, May Anomaly, NPL
1.84826, 2040-2059, ipsl_cm5a_lr, Jun Anomaly, NPL
1.53936, 2040-2059, ipsl_cm5a_lr, Jul Anomaly, NPL
1.66938, 2040-2059, ipsl_cm5a_lr, Aug Anomaly, NPL
1.9765, 2040-2059, ipsl_cm5a_lr, Sep Anomaly, NPL
2.35675, 2040-2059, ipsl_cm5a_lr, Oct Anomaly, NPL
2.82202, 2040-2059, ipsl_cm5a_lr, Nov Anomaly, NPL
2.41137, 2040-2059, ipsl_cm5a_lr, Dec Anomaly, NPL
3.34135, 2040-2059, ipsl_cm5a_mr, Jan Anomaly, NPL
3.40042, 2040-2059, ipsl_cm5a_mr, Feb Anomaly, NPL
3.09831, 2040-2059, ipsl_cm5a_mr, Mar Anomaly, NPL
3.11904, 2040-2059, ipsl_cm5a_mr, Apr Anomaly, NPL
2.58085, 2040-2059, ipsl_cm5a_mr, May Anomaly, NPL
1.86853, 2040-2059, ipsl_cm5a_mr, Jun Anomaly, NPL
1.72603, 2040-2059, ipsl_cm5a_mr, Jul Anomaly, NPL
1.50107, 2040-2059, ipsl_cm5a_mr, Aug Anomaly, NPL
1.70613, 2040-2059, ipsl_cm5a_mr, Sep Anomaly, NPL
2.26498, 2040-2059, ipsl_cm5a_mr, Oct Anomaly, NPL
2.16018, 2040-2059, ipsl_cm5a_mr, Nov Anomaly, NPL
2.55614, 2040-2059, ipsl_cm5a_mr, Dec Anomaly, NPL
1.39905, 2040-2059, miroc5, Jan Anomaly, NPL
1.83477, 2040-2059, miroc5, Feb Anomaly, NPL
1.05543, 2040-2059, miroc5, Mar Anomaly, NPL
1.35, 2040-2059, miroc5, Apr Anomaly, NPL
2.08353, 2040-2059, miroc5, May Anomaly, NPL
1.52432, 2040-2059, miroc5, Jun Anomaly, NPL
1.12217, 2040-2059, miroc5, Jul Anomaly, NPL
1.00528, 2040-2059, miroc5, Aug Anomaly, NPL
0.91734, 2040-2059, miroc5, Sep Anomaly, NPL
1.28702, 2040-2059, miroc5, Oct Anomaly, NPL
1.33673, 2040-2059, miroc5, Nov Anomaly, NPL
1.37247, 2040-2059, miroc5, Dec Anomaly, NPL
4.16806, 2040-2059, miroc_esm_chem, Jan Anomaly, NPL
3.37756, 2040-2059, miroc_esm_chem, Feb Anomaly, NPL
2.56821, 2040-2059, miroc_esm_chem, Mar Anomaly, NPL
3.92588, 2040-2059, miroc_esm_chem, Apr Anomaly, NPL
3.57303, 2040-2059, miroc_esm_chem, May Anomaly, NPL
2.29758, 2040-2059, miroc_esm_chem, Jun Anomaly, NPL
1.7474, 2040-2059, miroc_esm_chem, Jul Anomaly, NPL
1.65813, 2040-2059, miroc_esm_chem, Aug Anomaly, NPL
1.64237, 2040-2059, miroc_esm_chem, Sep Anomaly, NPL
1.17997, 2040-2059, miroc_esm_chem, Oct Anomaly, NPL
3.17866, 2040-2059, miroc_esm_chem, Nov Anomaly, NPL
4.56365, 2040-2059, miroc_esm_chem, Dec Anomaly, NPL
2.42239, 2040-2059, miroc_esm, Jan Anomaly, NPL
2.08808, 2040-2059, miroc_esm, Feb Anomaly, NPL
1.93318, 2040-2059, miroc_esm, Mar Anomaly, NPL
2.48518, 2040-2059, miroc_esm, Apr Anomaly, NPL
1.87825, 2040-2059, miroc_esm, May Anomaly, NPL
1.58784, 2040-2059, miroc_esm, Jun Anomaly, NPL
1.67676, 2040-2059, miroc_esm, Jul Anomaly, NPL
1.82888, 2040-2059, miroc_esm, Aug Anomaly, NPL
1.66524, 2040-2059, miroc_esm, Sep Anomaly, NPL
1.31992, 2040-2059, miroc_esm, Oct Anomaly, NPL
2.38989, 2040-2059, miroc_esm, Nov Anomaly, NPL
2.88269, 2040-2059, miroc_esm, Dec Anomaly, NPL
2.75174, 2040-2059, mri_cgcm3, Jan Anomaly, NPL
1.48515, 2040-2059, mri_cgcm3, Feb Anomaly, NPL
2.02351, 2040-2059, mri_cgcm3, Mar Anomaly, NPL
0.98458, 2040-2059, mri_cgcm3, Apr Anomaly, NPL
0.61505, 2040-2059, mri_cgcm3, May Anomaly, NPL
1.1682, 2040-2059, mri_cgcm3, Jun Anomaly, NPL
1.06433, 2040-2059, mri_cgcm3, Jul Anomaly, NPL
0.71972, 2040-2059, mri_cgcm3, Aug Anomaly, NPL
1.52977, 2040-2059, mri_cgcm3, Sep Anomaly, NPL
0.94376, 2040-2059, mri_cgcm3, Oct Anomaly, NPL
1.68673, 2040-2059, mri_cgcm3, Nov Anomaly, NPL
3.55178, 2040-2059, mri_cgcm3, Dec Anomaly, NPL
2.66763, 2040-2059, noresm1_m, Jan Anomaly, NPL
1.72266, 2040-2059, noresm1_m, Feb Anomaly, NPL
2.47899, 2040-2059, noresm1_m, Mar Anomaly, NPL
1.32183, 2040-2059, noresm1_m, Apr Anomaly, NPL
1.42292, 2040-2059, noresm1_m, May Anomaly, NPL
2.14779, 2040-2059, noresm1_m, Jun Anomaly, NPL
0.65561, 2040-2059, noresm1_m, Jul Anomaly, NPL
0.7877, 2040-2059, noresm1_m, Aug Anomaly, NPL
1.29573, 2040-2059, noresm1_m, Sep Anomaly, NPL
1.90119, 2040-2059, noresm1_m, Oct Anomaly, NPL
2.21993, 2040-2059, noresm1_m, Nov Anomaly, NPL
1.69127, 2040-2059, noresm1_m, Dec Anomaly, NPL
-0.3508, 2040-2059, Ensemble (10th Percentile), Jan Anomaly, NPL
-0.4253, 2040-2059, Ensemble (10th Percentile), Feb Anomaly, NPL
0.09819, 2040-2059, Ensemble (10th Percentile), Mar Anomaly, NPL
0.1358, 2040-2059, Ensemble (10th Percentile), Apr Anomaly, NPL
0.08962, 2040-2059, Ensemble (10th Percentile), May Anomaly, NPL
-0.7131, 2040-2059, Ensemble (10th Percentile), Jun Anomaly, NPL
-0.7246, 2040-2059, Ensemble (10th Percentile), Jul Anomaly, NPL
-1.2745, 2040-2059, Ensemble (10th Percentile), Aug Anomaly, NPL
-0.2009, 2040-2059, Ensemble (10th Percentile), Sep Anomaly, NPL
-0.5278, 2040-2059, Ensemble (10th Percentile), Oct Anomaly, NPL
-1.146, 2040-2059, Ensemble (10th Percentile), Nov Anomaly, NPL
-0.7727, 2040-2059, Ensemble (10th Percentile), Dec Anomaly, NPL
2.74568, 2040-2059, Ensemble (50th Percentile), Jan Anomaly, NPL
2.32358, 2040-2059, Ensemble (50th Percentile), Feb Anomaly, NPL
2.04891, 2040-2059, Ensemble (50th Percentile), Mar Anomaly, NPL
1.96112, 2040-2059, Ensemble (50th Percentile), Apr Anomaly, NPL
1.84446, 2040-2059, Ensemble (50th Percentile), May Anomaly, NPL
1.46202, 2040-2059, Ensemble (50th Percentile), Jun Anomaly, NPL
1.01128, 2040-2059, Ensemble (50th Percentile), Jul Anomaly, NPL
1.1973, 2040-2059, Ensemble (50th Percentile), Aug Anomaly, NPL
1.8234, 2040-2059, Ensemble (50th Percentile), Sep Anomaly, NPL
2.15746, 2040-2059, Ensemble (50th Percentile), Oct Anomaly, NPL
2.09367, 2040-2059, Ensemble (50th Percentile), Nov Anomaly, NPL
2.6747, 2040-2059, Ensemble (50th Percentile), Dec Anomaly, NPL
4.02563, 2040-2059, Ensemble (90th Percentile), Jan Anomaly, NPL
4.17877, 2040-2059, Ensemble (90th Percentile), Feb Anomaly, NPL
4.45779, 2040-2059, Ensemble (90th Percentile), Mar Anomaly, NPL
3.99507, 2040-2059, Ensemble (90th Percentile), Apr Anomaly, NPL
3.87179, 2040-2059, Ensemble (90th Percentile), May Anomaly, NPL
3.16753, 2040-2059, Ensemble (90th Percentile), Jun Anomaly, NPL
2.93127, 2040-2059, Ensemble (90th Percentile), Jul Anomaly, NPL
3.34497, 2040-2059, Ensemble (90th Percentile), Aug Anomaly, NPL
3.39303, 2040-2059, Ensemble (90th Percentile), Sep Anomaly, NPL
4.12087, 2040-2059, Ensemble (90th Percentile), Oct Anomaly, NPL
4.74716, 2040-2059, Ensemble (90th Percentile), Nov Anomaly, NPL
4.62285, 2040-2059, Ensemble (90th Percentile), Dec Anomaly, NPL
2.06091, 2040-2059, bcc_csm1_1_m, Annual Anomaly, NPL
1.59409, 2040-2059, bcc_csm1_1, Annual Anomaly, NPL
1.96097, 2040-2059, ccsm4, Annual Anomaly, NPL
2.94906, 2040-2059, cesm1_cam5, Annual Anomaly, NPL
2.31584, 2040-2059, csiro_mk3_6_0, Annual Anomaly, NPL
1.43891, 2040-2059, gfdl_cm3, Annual Anomaly, NPL
0.89422, 2040-2059, gfdl_esm2g, Annual Anomaly, NPL
0.5208, 2040-2059, gfdl_esm2m, Annual Anomaly, NPL
1.81591, 2040-2059, hadgem2_ao, Annual Anomaly, NPL
1.71711, 2040-2059, hadgem2_es, Annual Anomaly, NPL
1.79528, 2040-2059, ipsl_cm5a_lr, Annual Anomaly, NPL
3.59027, 2040-2059, ipsl_cm5a_mr, Annual Anomaly, NPL
1.54367, 2040-2059, miroc5, Annual Anomaly, NPL
3.68966, 2040-2059, miroc_esm_chem, Annual Anomaly, NPL
2.43425, 2040-2059, miroc_esm, Annual Anomaly, NPL
3.05479, 2040-2059, mri_cgcm3, Annual Anomaly, NPL
2.15212, 2040-2059, noresm1_m, Annual Anomaly, NPL
-0.5405, 2040-2059, Ensemble (10th Percentile), Annual Anomaly, NPL
2.69258, 2040-2059, Ensemble (50th Percentile), Annual Anomaly, NPL
4.26657, 2040-2059, Ensemble (90th Percentile), Annual Anomaly, NPL
