Number of Days without Noticeable Wind - (Days), Year, Model, Statistics, ISO3
0.27085, 2060-2079, bcc_csm1_1_m, Jan Anomaly, NPL
0.29579, 2060-2079, bcc_csm1_1_m, Feb Anomaly, NPL
-0.3167, 2060-2079, bcc_csm1_1_m, Mar Anomaly, NPL
-0.1013, 2060-2079, bcc_csm1_1_m, Apr Anomaly, NPL
-0.1529, 2060-2079, bcc_csm1_1_m, May Anomaly, NPL
0.20893, 2060-2079, bcc_csm1_1_m, Jun Anomaly, NPL
-0.2802, 2060-2079, bcc_csm1_1_m, Jul Anomaly, NPL
0.24093, 2060-2079, bcc_csm1_1_m, Aug Anomaly, NPL
0.97343, 2060-2079, bcc_csm1_1_m, Sep Anomaly, NPL
0.74811, 2060-2079, bcc_csm1_1_m, Oct Anomaly, NPL
0.37089, 2060-2079, bcc_csm1_1_m, Nov Anomaly, NPL
0.76506, 2060-2079, bcc_csm1_1_m, Dec Anomaly, NPL
-0.2449, 2060-2079, csiro_mk3_6_0, Jan Anomaly, NPL
-0.2447, 2060-2079, csiro_mk3_6_0, Feb Anomaly, NPL
-0.0608, 2060-2079, csiro_mk3_6_0, Mar Anomaly, NPL
-0.0884, 2060-2079, csiro_mk3_6_0, Apr Anomaly, NPL
0.47903, 2060-2079, csiro_mk3_6_0, May Anomaly, NPL
0.0201, 2060-2079, csiro_mk3_6_0, Jun Anomaly, NPL
1.64836, 2060-2079, csiro_mk3_6_0, Jul Anomaly, NPL
2.27255, 2060-2079, csiro_mk3_6_0, Aug Anomaly, NPL
1.71088, 2060-2079, csiro_mk3_6_0, Sep Anomaly, NPL
-0.1427, 2060-2079, csiro_mk3_6_0, Oct Anomaly, NPL
0.08542, 2060-2079, csiro_mk3_6_0, Nov Anomaly, NPL
-0.1222, 2060-2079, csiro_mk3_6_0, Dec Anomaly, NPL
1.05768, 2060-2079, gfdl_cm3, Jan Anomaly, NPL
0.68263, 2060-2079, gfdl_cm3, Feb Anomaly, NPL
-0.6731, 2060-2079, gfdl_cm3, Mar Anomaly, NPL
-0.6379, 2060-2079, gfdl_cm3, Apr Anomaly, NPL
-3.9161, 2060-2079, gfdl_cm3, May Anomaly, NPL
-8.1136, 2060-2079, gfdl_cm3, Jun Anomaly, NPL
-6.8628, 2060-2079, gfdl_cm3, Jul Anomaly, NPL
-8.2679, 2060-2079, gfdl_cm3, Aug Anomaly, NPL
-7.8818, 2060-2079, gfdl_cm3, Sep Anomaly, NPL
-3.1668, 2060-2079, gfdl_cm3, Oct Anomaly, NPL
0.11071, 2060-2079, gfdl_cm3, Nov Anomaly, NPL
1.54652, 2060-2079, gfdl_cm3, Dec Anomaly, NPL
2.88596, 2060-2079, gfdl_esm2g, Jan Anomaly, NPL
1.26886, 2060-2079, gfdl_esm2g, Feb Anomaly, NPL
0.49124, 2060-2079, gfdl_esm2g, Mar Anomaly, NPL
-0.5623, 2060-2079, gfdl_esm2g, Apr Anomaly, NPL
-0.5005, 2060-2079, gfdl_esm2g, May Anomaly, NPL
-0.1955, 2060-2079, gfdl_esm2g, Jun Anomaly, NPL
0.25251, 2060-2079, gfdl_esm2g, Jul Anomaly, NPL
-1.4186, 2060-2079, gfdl_esm2g, Aug Anomaly, NPL
-0.0383, 2060-2079, gfdl_esm2g, Sep Anomaly, NPL
2.03691, 2060-2079, gfdl_esm2g, Oct Anomaly, NPL
2.86603, 2060-2079, gfdl_esm2g, Nov Anomaly, NPL
0.73655, 2060-2079, gfdl_esm2g, Dec Anomaly, NPL
0.04673, 2060-2079, hadgem2_ao, Jan Anomaly, NPL
1.57658, 2060-2079, hadgem2_ao, Feb Anomaly, NPL
-1.2187, 2060-2079, hadgem2_ao, Mar Anomaly, NPL
-1.5466, 2060-2079, hadgem2_ao, Apr Anomaly, NPL
-0.2114, 2060-2079, hadgem2_ao, May Anomaly, NPL
-0.1703, 2060-2079, hadgem2_ao, Jun Anomaly, NPL
0.26603, 2060-2079, hadgem2_ao, Jul Anomaly, NPL
0.36278, 2060-2079, hadgem2_ao, Aug Anomaly, NPL
0.68133, 2060-2079, hadgem2_ao, Sep Anomaly, NPL
1.88292, 2060-2079, hadgem2_ao, Oct Anomaly, NPL
1.94633, 2060-2079, hadgem2_ao, Nov Anomaly, NPL
-1.2779, 2060-2079, hadgem2_ao, Dec Anomaly, NPL
0.36752, 2060-2079, hadgem2_es, Jan Anomaly, NPL
0.05393, 2060-2079, hadgem2_es, Feb Anomaly, NPL
-0.6948, 2060-2079, hadgem2_es, Mar Anomaly, NPL
-0.3637, 2060-2079, hadgem2_es, Apr Anomaly, NPL
0.12554, 2060-2079, hadgem2_es, May Anomaly, NPL
0.05265, 2060-2079, hadgem2_es, Jun Anomaly, NPL
0.42826, 2060-2079, hadgem2_es, Jul Anomaly, NPL
0.52665, 2060-2079, hadgem2_es, Aug Anomaly, NPL
0.86419, 2060-2079, hadgem2_es, Sep Anomaly, NPL
1.98405, 2060-2079, hadgem2_es, Oct Anomaly, NPL
-0.7977, 2060-2079, hadgem2_es, Nov Anomaly, NPL
0.65895, 2060-2079, hadgem2_es, Dec Anomaly, NPL
1.10998, 2060-2079, ipsl_cm5a_mr, Jan Anomaly, NPL
0.6909, 2060-2079, ipsl_cm5a_mr, Feb Anomaly, NPL
1.58982, 2060-2079, ipsl_cm5a_mr, Mar Anomaly, NPL
1.51832, 2060-2079, ipsl_cm5a_mr, Apr Anomaly, NPL
0.27031, 2060-2079, ipsl_cm5a_mr, May Anomaly, NPL
-1.316, 2060-2079, ipsl_cm5a_mr, Jun Anomaly, NPL
-0.0258, 2060-2079, ipsl_cm5a_mr, Jul Anomaly, NPL
-0.9732, 2060-2079, ipsl_cm5a_mr, Aug Anomaly, NPL
-0.0289, 2060-2079, ipsl_cm5a_mr, Sep Anomaly, NPL
0.69203, 2060-2079, ipsl_cm5a_mr, Oct Anomaly, NPL
1.33163, 2060-2079, ipsl_cm5a_mr, Nov Anomaly, NPL
3.4221, 2060-2079, ipsl_cm5a_mr, Dec Anomaly, NPL
3.26851, 2060-2079, miroc5, Jan Anomaly, NPL
2.74778, 2060-2079, miroc5, Feb Anomaly, NPL
2.49456, 2060-2079, miroc5, Mar Anomaly, NPL
-0.4582, 2060-2079, miroc5, Apr Anomaly, NPL
-1.0257, 2060-2079, miroc5, May Anomaly, NPL
-1.9511, 2060-2079, miroc5, Jun Anomaly, NPL
-0.8491, 2060-2079, miroc5, Jul Anomaly, NPL
0.29719, 2060-2079, miroc5, Aug Anomaly, NPL
-0.459, 2060-2079, miroc5, Sep Anomaly, NPL
-0.8082, 2060-2079, miroc5, Oct Anomaly, NPL
0.59925, 2060-2079, miroc5, Nov Anomaly, NPL
2.11849, 2060-2079, miroc5, Dec Anomaly, NPL
2.79449, 2060-2079, miroc_esm_chem, Jan Anomaly, NPL
2.22818, 2060-2079, miroc_esm_chem, Feb Anomaly, NPL
2.02352, 2060-2079, miroc_esm_chem, Mar Anomaly, NPL
2.66085, 2060-2079, miroc_esm_chem, Apr Anomaly, NPL
3.56445, 2060-2079, miroc_esm_chem, May Anomaly, NPL
2.16899, 2060-2079, miroc_esm_chem, Jun Anomaly, NPL
-2.1011, 2060-2079, miroc_esm_chem, Jul Anomaly, NPL
1.08857, 2060-2079, miroc_esm_chem, Aug Anomaly, NPL
1.72788, 2060-2079, miroc_esm_chem, Sep Anomaly, NPL
2.19311, 2060-2079, miroc_esm_chem, Oct Anomaly, NPL
3.12354, 2060-2079, miroc_esm_chem, Nov Anomaly, NPL
3.87476, 2060-2079, miroc_esm_chem, Dec Anomaly, NPL
2.91329, 2060-2079, miroc_esm, Jan Anomaly, NPL
1.40751, 2060-2079, miroc_esm, Feb Anomaly, NPL
2.48481, 2060-2079, miroc_esm, Mar Anomaly, NPL
2.80464, 2060-2079, miroc_esm, Apr Anomaly, NPL
2.27055, 2060-2079, miroc_esm, May Anomaly, NPL
2.17918, 2060-2079, miroc_esm, Jun Anomaly, NPL
-1.5558, 2060-2079, miroc_esm, Jul Anomaly, NPL
-0.4476, 2060-2079, miroc_esm, Aug Anomaly, NPL
0.31029, 2060-2079, miroc_esm, Sep Anomaly, NPL
2.02266, 2060-2079, miroc_esm, Oct Anomaly, NPL
3.03903, 2060-2079, miroc_esm, Nov Anomaly, NPL
3.40118, 2060-2079, miroc_esm, Dec Anomaly, NPL
-5.2619, 2060-2079, Ensemble (10th Percentile), Jan Anomaly, NPL
-3.5134, 2060-2079, Ensemble (10th Percentile), Feb Anomaly, NPL
-3.0201, 2060-2079, Ensemble (10th Percentile), Mar Anomaly, NPL
-2.7627, 2060-2079, Ensemble (10th Percentile), Apr Anomaly, NPL
-2.7313, 2060-2079, Ensemble (10th Percentile), May Anomaly, NPL
-2.8283, 2060-2079, Ensemble (10th Percentile), Jun Anomaly, NPL
-2.5029, 2060-2079, Ensemble (10th Percentile), Jul Anomaly, NPL
-3.0149, 2060-2079, Ensemble (10th Percentile), Aug Anomaly, NPL
-5.2087, 2060-2079, Ensemble (10th Percentile), Sep Anomaly, NPL
-7.7271, 2060-2079, Ensemble (10th Percentile), Oct Anomaly, NPL
-7.6327, 2060-2079, Ensemble (10th Percentile), Nov Anomaly, NPL
-6.6773, 2060-2079, Ensemble (10th Percentile), Dec Anomaly, NPL
3.11287, 2060-2079, Ensemble (50th Percentile), Jan Anomaly, NPL
2.39835, 2060-2079, Ensemble (50th Percentile), Feb Anomaly, NPL
2.05146, 2060-2079, Ensemble (50th Percentile), Mar Anomaly, NPL
1.89344, 2060-2079, Ensemble (50th Percentile), Apr Anomaly, NPL
2.99701, 2060-2079, Ensemble (50th Percentile), May Anomaly, NPL
3.66037, 2060-2079, Ensemble (50th Percentile), Jun Anomaly, NPL
2.33763, 2060-2079, Ensemble (50th Percentile), Jul Anomaly, NPL
1.80219, 2060-2079, Ensemble (50th Percentile), Aug Anomaly, NPL
0.97403, 2060-2079, Ensemble (50th Percentile), Sep Anomaly, NPL
4.75891, 2060-2079, Ensemble (50th Percentile), Oct Anomaly, NPL
5.28609, 2060-2079, Ensemble (50th Percentile), Nov Anomaly, NPL
4.12355, 2060-2079, Ensemble (50th Percentile), Dec Anomaly, NPL
0.0, 2060-2079, Ensemble (90th Percentile), Jan Anomaly, NPL
0.0, 2060-2079, Ensemble (90th Percentile), Feb Anomaly, NPL
0.0, 2060-2079, Ensemble (90th Percentile), Mar Anomaly, NPL
0.0, 2060-2079, Ensemble (90th Percentile), Apr Anomaly, NPL
0.0, 2060-2079, Ensemble (90th Percentile), May Anomaly, NPL
0.0, 2060-2079, Ensemble (90th Percentile), Jun Anomaly, NPL
0.0, 2060-2079, Ensemble (90th Percentile), Jul Anomaly, NPL
0.0, 2060-2079, Ensemble (90th Percentile), Aug Anomaly, NPL
0.0, 2060-2079, Ensemble (90th Percentile), Sep Anomaly, NPL
0.0, 2060-2079, Ensemble (90th Percentile), Oct Anomaly, NPL
0.0, 2060-2079, Ensemble (90th Percentile), Nov Anomaly, NPL
0.0, 2060-2079, Ensemble (90th Percentile), Dec Anomaly, NPL
3.02274, 2060-2079, bcc_csm1_1_m, Annual Anomaly, NPL
1.19603, 2060-2079, bcc_csm1_1, Annual Anomaly, NPL
5.31236, 2060-2079, csiro_mk3_6_0, Annual Anomaly, NPL
-36.122, 2060-2079, gfdl_cm3, Annual Anomaly, NPL
7.82254, 2060-2079, gfdl_esm2g, Annual Anomaly, NPL
-5.254, 2060-2079, gfdl_esm2m, Annual Anomaly, NPL
2.22854, 2060-2079, hadgem2_ao, Annual Anomaly, NPL
3.07035, 2060-2079, hadgem2_es, Annual Anomaly, NPL
7.70613, 2060-2079, ipsl_cm5a_lr, Annual Anomaly, NPL
8.28099, 2060-2079, ipsl_cm5a_mr, Annual Anomaly, NPL
5.97418, 2060-2079, miroc5, Annual Anomaly, NPL
25.3472, 2060-2079, miroc_esm_chem, Annual Anomaly, NPL
20.8344, 2060-2079, miroc_esm, Annual Anomaly, NPL
4.63585, 2060-2079, mri_cgcm3, Annual Anomaly, NPL
-46.602, 2060-2079, Ensemble (10th Percentile), Annual Anomaly, NPL
2.01045, 2060-2079, Ensemble (50th Percentile), Annual Anomaly, NPL
97.887, 2060-2079, Ensemble (90th Percentile), Annual Anomaly, NPL
