Number of Summer Days (Tmax > 25°C) - (Days), Year, Model, Statistics, ISO3
2.24143, 2060-2079, access1_0, Jan Anomaly, NPL
5.25978, 2060-2079, access1_0, Feb Anomaly, NPL
7.2276, 2060-2079, access1_0, Mar Anomaly, NPL
3.68179, 2060-2079, access1_0, Apr Anomaly, NPL
2.51925, 2060-2079, access1_0, May Anomaly, NPL
1.62511, 2060-2079, access1_0, Jun Anomaly, NPL
2.34574, 2060-2079, access1_0, Jul Anomaly, NPL
2.49982, 2060-2079, access1_0, Aug Anomaly, NPL
3.10456, 2060-2079, access1_0, Sep Anomaly, NPL
6.73724, 2060-2079, access1_0, Oct Anomaly, NPL
7.05143, 2060-2079, access1_0, Nov Anomaly, NPL
3.72052, 2060-2079, access1_0, Dec Anomaly, NPL
1.0453, 2060-2079, access1_3, Jan Anomaly, NPL
2.72427, 2060-2079, access1_3, Feb Anomaly, NPL
5.35601, 2060-2079, access1_3, Mar Anomaly, NPL
3.97931, 2060-2079, access1_3, Apr Anomaly, NPL
2.51971, 2060-2079, access1_3, May Anomaly, NPL
0.82974, 2060-2079, access1_3, Jun Anomaly, NPL
1.59914, 2060-2079, access1_3, Jul Anomaly, NPL
1.31579, 2060-2079, access1_3, Aug Anomaly, NPL
2.3558, 2060-2079, access1_3, Sep Anomaly, NPL
3.99801, 2060-2079, access1_3, Oct Anomaly, NPL
4.1423, 2060-2079, access1_3, Nov Anomaly, NPL
1.68563, 2060-2079, access1_3, Dec Anomaly, NPL
1.321, 2060-2079, bcc_csm1_1_m, Jan Anomaly, NPL
1.97445, 2060-2079, bcc_csm1_1_m, Feb Anomaly, NPL
4.59531, 2060-2079, bcc_csm1_1_m, Mar Anomaly, NPL
3.75244, 2060-2079, bcc_csm1_1_m, Apr Anomaly, NPL
1.85407, 2060-2079, bcc_csm1_1_m, May Anomaly, NPL
2.35394, 2060-2079, bcc_csm1_1_m, Jun Anomaly, NPL
3.70734, 2060-2079, bcc_csm1_1_m, Jul Anomaly, NPL
3.69689, 2060-2079, bcc_csm1_1_m, Aug Anomaly, NPL
2.65881, 2060-2079, bcc_csm1_1_m, Sep Anomaly, NPL
3.11031, 2060-2079, bcc_csm1_1_m, Oct Anomaly, NPL
4.72549, 2060-2079, bcc_csm1_1_m, Nov Anomaly, NPL
1.82691, 2060-2079, bcc_csm1_1_m, Dec Anomaly, NPL
0.42772, 2060-2079, bcc_csm1_1, Jan Anomaly, NPL
0.82723, 2060-2079, bcc_csm1_1, Feb Anomaly, NPL
4.36364, 2060-2079, bcc_csm1_1, Mar Anomaly, NPL
3.9944, 2060-2079, bcc_csm1_1, Apr Anomaly, NPL
1.73557, 2060-2079, bcc_csm1_1, May Anomaly, NPL
1.61862, 2060-2079, bcc_csm1_1, Jun Anomaly, NPL
3.65276, 2060-2079, bcc_csm1_1, Jul Anomaly, NPL
1.96429, 2060-2079, bcc_csm1_1, Aug Anomaly, NPL
1.27107, 2060-2079, bcc_csm1_1, Sep Anomaly, NPL
4.30321, 2060-2079, bcc_csm1_1, Oct Anomaly, NPL
3.09625, 2060-2079, bcc_csm1_1, Nov Anomaly, NPL
0.51832, 2060-2079, bcc_csm1_1, Dec Anomaly, NPL
2.30835, 2060-2079, bnu_esm, Jan Anomaly, NPL
3.64022, 2060-2079, bnu_esm, Feb Anomaly, NPL
6.66392, 2060-2079, bnu_esm, Mar Anomaly, NPL
3.85305, 2060-2079, bnu_esm, Apr Anomaly, NPL
2.02017, 2060-2079, bnu_esm, May Anomaly, NPL
4.00411, 2060-2079, bnu_esm, Jun Anomaly, NPL
3.1199, 2060-2079, bnu_esm, Jul Anomaly, NPL
2.43505, 2060-2079, bnu_esm, Aug Anomaly, NPL
2.20824, 2060-2079, bnu_esm, Sep Anomaly, NPL
3.48431, 2060-2079, bnu_esm, Oct Anomaly, NPL
3.95006, 2060-2079, bnu_esm, Nov Anomaly, NPL
2.25668, 2060-2079, bnu_esm, Dec Anomaly, NPL
2.93101, 2060-2079, canesm2, Jan Anomaly, NPL
3.63236, 2060-2079, canesm2, Feb Anomaly, NPL
6.17131, 2060-2079, canesm2, Mar Anomaly, NPL
2.83777, 2060-2079, canesm2, Apr Anomaly, NPL
3.12515, 2060-2079, canesm2, May Anomaly, NPL
3.44962, 2060-2079, canesm2, Jun Anomaly, NPL
4.75584, 2060-2079, canesm2, Jul Anomaly, NPL
5.82204, 2060-2079, canesm2, Aug Anomaly, NPL
5.81887, 2060-2079, canesm2, Sep Anomaly, NPL
5.03475, 2060-2079, canesm2, Oct Anomaly, NPL
5.45462, 2060-2079, canesm2, Nov Anomaly, NPL
3.61135, 2060-2079, canesm2, Dec Anomaly, NPL
2.78168, 2060-2079, ccsm4, Jan Anomaly, NPL
3.38032, 2060-2079, ccsm4, Feb Anomaly, NPL
6.55466, 2060-2079, ccsm4, Mar Anomaly, NPL
3.07671, 2060-2079, ccsm4, Apr Anomaly, NPL
1.71913, 2060-2079, ccsm4, May Anomaly, NPL
2.96779, 2060-2079, ccsm4, Jun Anomaly, NPL
4.27236, 2060-2079, ccsm4, Jul Anomaly, NPL
3.70621, 2060-2079, ccsm4, Aug Anomaly, NPL
4.38096, 2060-2079, ccsm4, Sep Anomaly, NPL
4.2271, 2060-2079, ccsm4, Oct Anomaly, NPL
4.94203, 2060-2079, ccsm4, Nov Anomaly, NPL
3.74646, 2060-2079, ccsm4, Dec Anomaly, NPL
2.54332, 2060-2079, cesm1_bgc, Jan Anomaly, NPL
3.27281, 2060-2079, cesm1_bgc, Feb Anomaly, NPL
5.87791, 2060-2079, cesm1_bgc, Mar Anomaly, NPL
2.61128, 2060-2079, cesm1_bgc, Apr Anomaly, NPL
1.42166, 2060-2079, cesm1_bgc, May Anomaly, NPL
3.54163, 2060-2079, cesm1_bgc, Jun Anomaly, NPL
4.1695, 2060-2079, cesm1_bgc, Jul Anomaly, NPL
3.63533, 2060-2079, cesm1_bgc, Aug Anomaly, NPL
5.09756, 2060-2079, cesm1_bgc, Sep Anomaly, NPL
4.55338, 2060-2079, cesm1_bgc, Oct Anomaly, NPL
5.64302, 2060-2079, cesm1_bgc, Nov Anomaly, NPL
3.40603, 2060-2079, cesm1_bgc, Dec Anomaly, NPL
4.4251, 2060-2079, cesm1_cam5, Jan Anomaly, NPL
4.97419, 2060-2079, cesm1_cam5, Feb Anomaly, NPL
4.41215, 2060-2079, cesm1_cam5, Mar Anomaly, NPL
2.55799, 2060-2079, cesm1_cam5, Apr Anomaly, NPL
2.72721, 2060-2079, cesm1_cam5, May Anomaly, NPL
4.66308, 2060-2079, cesm1_cam5, Jun Anomaly, NPL
5.77058, 2060-2079, cesm1_cam5, Jul Anomaly, NPL
5.22395, 2060-2079, cesm1_cam5, Aug Anomaly, NPL
5.67357, 2060-2079, cesm1_cam5, Sep Anomaly, NPL
4.99711, 2060-2079, cesm1_cam5, Oct Anomaly, NPL
7.34, 2060-2079, cesm1_cam5, Nov Anomaly, NPL
5.33465, 2060-2079, cesm1_cam5, Dec Anomaly, NPL
2.65484, 2060-2079, cmcc_cesm, Jan Anomaly, NPL
4.66994, 2060-2079, cmcc_cesm, Feb Anomaly, NPL
7.24367, 2060-2079, cmcc_cesm, Mar Anomaly, NPL
4.14523, 2060-2079, cmcc_cesm, Apr Anomaly, NPL
2.85703, 2060-2079, cmcc_cesm, May Anomaly, NPL
3.1388, 2060-2079, cmcc_cesm, Jun Anomaly, NPL
1.83276, 2060-2079, cmcc_cesm, Jul Anomaly, NPL
2.05098, 2060-2079, cmcc_cesm, Aug Anomaly, NPL
3.07475, 2060-2079, cmcc_cesm, Sep Anomaly, NPL
4.74927, 2060-2079, cmcc_cesm, Oct Anomaly, NPL
4.66779, 2060-2079, cmcc_cesm, Nov Anomaly, NPL
3.11675, 2060-2079, cmcc_cesm, Dec Anomaly, NPL
1.04409, 2060-2079, cmcc_cm, Jan Anomaly, NPL
4.50496, 2060-2079, cmcc_cm, Feb Anomaly, NPL
6.23689, 2060-2079, cmcc_cm, Mar Anomaly, NPL
2.76353, 2060-2079, cmcc_cm, Apr Anomaly, NPL
1.1191, 2060-2079, cmcc_cm, May Anomaly, NPL
1.44858, 2060-2079, cmcc_cm, Jun Anomaly, NPL
3.84519, 2060-2079, cmcc_cm, Jul Anomaly, NPL
5.0381, 2060-2079, cmcc_cm, Aug Anomaly, NPL
3.48341, 2060-2079, cmcc_cm, Sep Anomaly, NPL
5.10167, 2060-2079, cmcc_cm, Oct Anomaly, NPL
3.91495, 2060-2079, cmcc_cm, Nov Anomaly, NPL
1.50152, 2060-2079, cmcc_cm, Dec Anomaly, NPL
2.50083, 2060-2079, cmcc_cms, Jan Anomaly, NPL
4.44967, 2060-2079, cmcc_cms, Feb Anomaly, NPL
7.3199, 2060-2079, cmcc_cms, Mar Anomaly, NPL
4.03417, 2060-2079, cmcc_cms, Apr Anomaly, NPL
2.12807, 2060-2079, cmcc_cms, May Anomaly, NPL
2.53559, 2060-2079, cmcc_cms, Jun Anomaly, NPL
4.02561, 2060-2079, cmcc_cms, Jul Anomaly, NPL
4.1625, 2060-2079, cmcc_cms, Aug Anomaly, NPL
4.4142, 2060-2079, cmcc_cms, Sep Anomaly, NPL
6.3962, 2060-2079, cmcc_cms, Oct Anomaly, NPL
5.76095, 2060-2079, cmcc_cms, Nov Anomaly, NPL
3.69506, 2060-2079, cmcc_cms, Dec Anomaly, NPL
1.3468, 2060-2079, cnrm_cm5, Jan Anomaly, NPL
2.75388, 2060-2079, cnrm_cm5, Feb Anomaly, NPL
3.30257, 2060-2079, cnrm_cm5, Mar Anomaly, NPL
2.47318, 2060-2079, cnrm_cm5, Apr Anomaly, NPL
0.83514, 2060-2079, cnrm_cm5, May Anomaly, NPL
1.43124, 2060-2079, cnrm_cm5, Jun Anomaly, NPL
2.11918, 2060-2079, cnrm_cm5, Jul Anomaly, NPL
1.81527, 2060-2079, cnrm_cm5, Aug Anomaly, NPL
2.22442, 2060-2079, cnrm_cm5, Sep Anomaly, NPL
3.36722, 2060-2079, cnrm_cm5, Oct Anomaly, NPL
3.53996, 2060-2079, cnrm_cm5, Nov Anomaly, NPL
1.18468, 2060-2079, cnrm_cm5, Dec Anomaly, NPL
1.16276, 2060-2079, csiro_mk3_6_0, Jan Anomaly, NPL
3.19031, 2060-2079, csiro_mk3_6_0, Feb Anomaly, NPL
5.93386, 2060-2079, csiro_mk3_6_0, Mar Anomaly, NPL
3.35024, 2060-2079, csiro_mk3_6_0, Apr Anomaly, NPL
1.48939, 2060-2079, csiro_mk3_6_0, May Anomaly, NPL
1.86961, 2060-2079, csiro_mk3_6_0, Jun Anomaly, NPL
4.31454, 2060-2079, csiro_mk3_6_0, Jul Anomaly, NPL
3.08894, 2060-2079, csiro_mk3_6_0, Aug Anomaly, NPL
2.36607, 2060-2079, csiro_mk3_6_0, Sep Anomaly, NPL
2.70337, 2060-2079, csiro_mk3_6_0, Oct Anomaly, NPL
3.55216, 2060-2079, csiro_mk3_6_0, Nov Anomaly, NPL
1.37288, 2060-2079, csiro_mk3_6_0, Dec Anomaly, NPL
3.20729, 2060-2079, gfdl_cm3, Jan Anomaly, NPL
3.98822, 2060-2079, gfdl_cm3, Feb Anomaly, NPL
4.81818, 2060-2079, gfdl_cm3, Mar Anomaly, NPL
3.74819, 2060-2079, gfdl_cm3, Apr Anomaly, NPL
3.39146, 2060-2079, gfdl_cm3, May Anomaly, NPL
3.40101, 2060-2079, gfdl_cm3, Jun Anomaly, NPL
4.04364, 2060-2079, gfdl_cm3, Jul Anomaly, NPL
3.99529, 2060-2079, gfdl_cm3, Aug Anomaly, NPL
5.3854, 2060-2079, gfdl_cm3, Sep Anomaly, NPL
7.44943, 2060-2079, gfdl_cm3, Oct Anomaly, NPL
7.52545, 2060-2079, gfdl_cm3, Nov Anomaly, NPL
4.91365, 2060-2079, gfdl_cm3, Dec Anomaly, NPL
2.32525, 2060-2079, gfdl_esm2g, Jan Anomaly, NPL
2.50376, 2060-2079, gfdl_esm2g, Feb Anomaly, NPL
6.53591, 2060-2079, gfdl_esm2g, Mar Anomaly, NPL
3.36694, 2060-2079, gfdl_esm2g, Apr Anomaly, NPL
1.63737, 2060-2079, gfdl_esm2g, May Anomaly, NPL
3.78853, 2060-2079, gfdl_esm2g, Jun Anomaly, NPL
4.27828, 2060-2079, gfdl_esm2g, Jul Anomaly, NPL
3.424, 2060-2079, gfdl_esm2g, Aug Anomaly, NPL
4.29847, 2060-2079, gfdl_esm2g, Sep Anomaly, NPL
6.15204, 2060-2079, gfdl_esm2g, Oct Anomaly, NPL
4.56948, 2060-2079, gfdl_esm2g, Nov Anomaly, NPL
2.23623, 2060-2079, gfdl_esm2g, Dec Anomaly, NPL
2.63601, 2060-2079, gfdl_esm2m, Jan Anomaly, NPL
2.70773, 2060-2079, gfdl_esm2m, Feb Anomaly, NPL
4.73248, 2060-2079, gfdl_esm2m, Mar Anomaly, NPL
2.89691, 2060-2079, gfdl_esm2m, Apr Anomaly, NPL
1.6336, 2060-2079, gfdl_esm2m, May Anomaly, NPL
2.77974, 2060-2079, gfdl_esm2m, Jun Anomaly, NPL
3.64461, 2060-2079, gfdl_esm2m, Jul Anomaly, NPL
4.28194, 2060-2079, gfdl_esm2m, Aug Anomaly, NPL
4.60669, 2060-2079, gfdl_esm2m, Sep Anomaly, NPL
6.03448, 2060-2079, gfdl_esm2m, Oct Anomaly, NPL
4.74486, 2060-2079, gfdl_esm2m, Nov Anomaly, NPL
1.38507, 2060-2079, gfdl_esm2m, Dec Anomaly, NPL
1.39195, 2060-2079, hadgem2_ao, Jan Anomaly, NPL
3.1994, 2060-2079, hadgem2_ao, Feb Anomaly, NPL
5.54926, 2060-2079, hadgem2_ao, Mar Anomaly, NPL
3.53422, 2060-2079, hadgem2_ao, Apr Anomaly, NPL
1.30068, 2060-2079, hadgem2_ao, May Anomaly, NPL
1.25249, 2060-2079, hadgem2_ao, Jun Anomaly, NPL
1.85269, 2060-2079, hadgem2_ao, Jul Anomaly, NPL
2.10083, 2060-2079, hadgem2_ao, Aug Anomaly, NPL
2.64536, 2060-2079, hadgem2_ao, Sep Anomaly, NPL
5.46921, 2060-2079, hadgem2_ao, Oct Anomaly, NPL
7.19569, 2060-2079, hadgem2_ao, Nov Anomaly, NPL
2.45493, 2060-2079, hadgem2_ao, Dec Anomaly, NPL
3.58843, 2060-2079, hadgem2_cc, Jan Anomaly, NPL
4.85385, 2060-2079, hadgem2_cc, Feb Anomaly, NPL
5.75326, 2060-2079, hadgem2_cc, Mar Anomaly, NPL
3.86749, 2060-2079, hadgem2_cc, Apr Anomaly, NPL
2.70433, 2060-2079, hadgem2_cc, May Anomaly, NPL
2.18271, 2060-2079, hadgem2_cc, Jun Anomaly, NPL
2.41791, 2060-2079, hadgem2_cc, Jul Anomaly, NPL
2.38391, 2060-2079, hadgem2_cc, Aug Anomaly, NPL
2.78362, 2060-2079, hadgem2_cc, Sep Anomaly, NPL
5.68738, 2060-2079, hadgem2_cc, Oct Anomaly, NPL
8.75265, 2060-2079, hadgem2_cc, Nov Anomaly, NPL
4.6208, 2060-2079, hadgem2_cc, Dec Anomaly, NPL
3.33792, 2060-2079, hadgem2_es, Jan Anomaly, NPL
5.4457, 2060-2079, hadgem2_es, Feb Anomaly, NPL
6.2544, 2060-2079, hadgem2_es, Mar Anomaly, NPL
4.60014, 2060-2079, hadgem2_es, Apr Anomaly, NPL
3.01266, 2060-2079, hadgem2_es, May Anomaly, NPL
2.37763, 2060-2079, hadgem2_es, Jun Anomaly, NPL
2.60848, 2060-2079, hadgem2_es, Jul Anomaly, NPL
2.35588, 2060-2079, hadgem2_es, Aug Anomaly, NPL
2.80134, 2060-2079, hadgem2_es, Sep Anomaly, NPL
5.73967, 2060-2079, hadgem2_es, Oct Anomaly, NPL
8.62197, 2060-2079, hadgem2_es, Nov Anomaly, NPL
3.95877, 2060-2079, hadgem2_es, Dec Anomaly, NPL
1.49293, 2060-2079, inmcm4, Jan Anomaly, NPL
3.56008, 2060-2079, inmcm4, Feb Anomaly, NPL
3.84131, 2060-2079, inmcm4, Mar Anomaly, NPL
1.5918, 2060-2079, inmcm4, Apr Anomaly, NPL
0.58623, 2060-2079, inmcm4, May Anomaly, NPL
0.72813, 2060-2079, inmcm4, Jun Anomaly, NPL
1.30264, 2060-2079, inmcm4, Jul Anomaly, NPL
1.60252, 2060-2079, inmcm4, Aug Anomaly, NPL
2.64209, 2060-2079, inmcm4, Sep Anomaly, NPL
3.7382, 2060-2079, inmcm4, Oct Anomaly, NPL
2.01032, 2060-2079, inmcm4, Nov Anomaly, NPL
1.05239, 2060-2079, inmcm4, Dec Anomaly, NPL
4.12232, 2060-2079, ipsl_cm5a_lr, Jan Anomaly, NPL
5.31365, 2060-2079, ipsl_cm5a_lr, Feb Anomaly, NPL
8.5884, 2060-2079, ipsl_cm5a_lr, Mar Anomaly, NPL
6.09283, 2060-2079, ipsl_cm5a_lr, Apr Anomaly, NPL
3.46928, 2060-2079, ipsl_cm5a_lr, May Anomaly, NPL
0.83669, 2060-2079, ipsl_cm5a_lr, Jun Anomaly, NPL
2.1386, 2060-2079, ipsl_cm5a_lr, Jul Anomaly, NPL
2.63291, 2060-2079, ipsl_cm5a_lr, Aug Anomaly, NPL
3.97631, 2060-2079, ipsl_cm5a_lr, Sep Anomaly, NPL
6.90442, 2060-2079, ipsl_cm5a_lr, Oct Anomaly, NPL
7.09732, 2060-2079, ipsl_cm5a_lr, Nov Anomaly, NPL
4.75236, 2060-2079, ipsl_cm5a_lr, Dec Anomaly, NPL
2.78216, 2060-2079, ipsl_cm5a_mr, Jan Anomaly, NPL
5.28398, 2060-2079, ipsl_cm5a_mr, Feb Anomaly, NPL
7.70356, 2060-2079, ipsl_cm5a_mr, Mar Anomaly, NPL
5.99175, 2060-2079, ipsl_cm5a_mr, Apr Anomaly, NPL
2.90179, 2060-2079, ipsl_cm5a_mr, May Anomaly, NPL
1.73098, 2060-2079, ipsl_cm5a_mr, Jun Anomaly, NPL
2.89212, 2060-2079, ipsl_cm5a_mr, Jul Anomaly, NPL
3.99905, 2060-2079, ipsl_cm5a_mr, Aug Anomaly, NPL
4.75528, 2060-2079, ipsl_cm5a_mr, Sep Anomaly, NPL
6.75951, 2060-2079, ipsl_cm5a_mr, Oct Anomaly, NPL
6.99049, 2060-2079, ipsl_cm5a_mr, Nov Anomaly, NPL
3.20549, 2060-2079, ipsl_cm5a_mr, Dec Anomaly, NPL
0.74854, 2060-2079, ipsl_cm5b_lr, Jan Anomaly, NPL
2.08149, 2060-2079, ipsl_cm5b_lr, Feb Anomaly, NPL
3.50748, 2060-2079, ipsl_cm5b_lr, Mar Anomaly, NPL
4.84702, 2060-2079, ipsl_cm5b_lr, Apr Anomaly, NPL
2.88759, 2060-2079, ipsl_cm5b_lr, May Anomaly, NPL
1.69175, 2060-2079, ipsl_cm5b_lr, Jun Anomaly, NPL
2.22156, 2060-2079, ipsl_cm5b_lr, Jul Anomaly, NPL
1.78253, 2060-2079, ipsl_cm5b_lr, Aug Anomaly, NPL
0.86033, 2060-2079, ipsl_cm5b_lr, Sep Anomaly, NPL
4.36728, 2060-2079, ipsl_cm5b_lr, Oct Anomaly, NPL
4.49308, 2060-2079, ipsl_cm5b_lr, Nov Anomaly, NPL
1.57679, 2060-2079, ipsl_cm5b_lr, Dec Anomaly, NPL
2.29245, 2060-2079, miroc5, Jan Anomaly, NPL
3.59926, 2060-2079, miroc5, Feb Anomaly, NPL
4.94271, 2060-2079, miroc5, Mar Anomaly, NPL
3.10622, 2060-2079, miroc5, Apr Anomaly, NPL
1.5132, 2060-2079, miroc5, May Anomaly, NPL
2.38699, 2060-2079, miroc5, Jun Anomaly, NPL
2.39477, 2060-2079, miroc5, Jul Anomaly, NPL
2.90965, 2060-2079, miroc5, Aug Anomaly, NPL
2.8285, 2060-2079, miroc5, Sep Anomaly, NPL
3.20009, 2060-2079, miroc5, Oct Anomaly, NPL
4.57719, 2060-2079, miroc5, Nov Anomaly, NPL
2.60107, 2060-2079, miroc5, Dec Anomaly, NPL
4.05862, 2060-2079, miroc_esm_chem, Jan Anomaly, NPL
6.11441, 2060-2079, miroc_esm_chem, Feb Anomaly, NPL
8.5611, 2060-2079, miroc_esm_chem, Mar Anomaly, NPL
6.1708, 2060-2079, miroc_esm_chem, Apr Anomaly, NPL
2.9917, 2060-2079, miroc_esm_chem, May Anomaly, NPL
3.02024, 2060-2079, miroc_esm_chem, Jun Anomaly, NPL
1.86789, 2060-2079, miroc_esm_chem, Jul Anomaly, NPL
2.83658, 2060-2079, miroc_esm_chem, Aug Anomaly, NPL
2.98387, 2060-2079, miroc_esm_chem, Sep Anomaly, NPL
4.46351, 2060-2079, miroc_esm_chem, Oct Anomaly, NPL
5.83494, 2060-2079, miroc_esm_chem, Nov Anomaly, NPL
4.50921, 2060-2079, miroc_esm_chem, Dec Anomaly, NPL
2.92248, 2060-2079, miroc_esm, Jan Anomaly, NPL
4.5145, 2060-2079, miroc_esm, Feb Anomaly, NPL
6.99632, 2060-2079, miroc_esm, Mar Anomaly, NPL
4.99143, 2060-2079, miroc_esm, Apr Anomaly, NPL
2.57675, 2060-2079, miroc_esm, May Anomaly, NPL
2.26886, 2060-2079, miroc_esm, Jun Anomaly, NPL
1.08801, 2060-2079, miroc_esm, Jul Anomaly, NPL
2.64569, 2060-2079, miroc_esm, Aug Anomaly, NPL
3.04193, 2060-2079, miroc_esm, Sep Anomaly, NPL
5.80081, 2060-2079, miroc_esm, Oct Anomaly, NPL
5.77822, 2060-2079, miroc_esm, Nov Anomaly, NPL
3.26288, 2060-2079, miroc_esm, Dec Anomaly, NPL
1.88607, 2060-2079, mpi_esm_lr, Jan Anomaly, NPL
3.21747, 2060-2079, mpi_esm_lr, Feb Anomaly, NPL
5.96932, 2060-2079, mpi_esm_lr, Mar Anomaly, NPL
3.47386, 2060-2079, mpi_esm_lr, Apr Anomaly, NPL
1.78424, 2060-2079, mpi_esm_lr, May Anomaly, NPL
2.24732, 2060-2079, mpi_esm_lr, Jun Anomaly, NPL
4.29209, 2060-2079, mpi_esm_lr, Jul Anomaly, NPL
4.18936, 2060-2079, mpi_esm_lr, Aug Anomaly, NPL
3.95742, 2060-2079, mpi_esm_lr, Sep Anomaly, NPL
4.56328, 2060-2079, mpi_esm_lr, Oct Anomaly, NPL
5.7037, 2060-2079, mpi_esm_lr, Nov Anomaly, NPL
3.09657, 2060-2079, mpi_esm_lr, Dec Anomaly, NPL
1.56395, 2060-2079, mpi_esm_mr, Jan Anomaly, NPL
3.65788, 2060-2079, mpi_esm_mr, Feb Anomaly, NPL
6.1193, 2060-2079, mpi_esm_mr, Mar Anomaly, NPL
3.4316, 2060-2079, mpi_esm_mr, Apr Anomaly, NPL
2.23712, 2060-2079, mpi_esm_mr, May Anomaly, NPL
2.42078, 2060-2079, mpi_esm_mr, Jun Anomaly, NPL
4.65621, 2060-2079, mpi_esm_mr, Jul Anomaly, NPL
4.5904, 2060-2079, mpi_esm_mr, Aug Anomaly, NPL
3.98462, 2060-2079, mpi_esm_mr, Sep Anomaly, NPL
4.97967, 2060-2079, mpi_esm_mr, Oct Anomaly, NPL
5.25546, 2060-2079, mpi_esm_mr, Nov Anomaly, NPL
3.06593, 2060-2079, mpi_esm_mr, Dec Anomaly, NPL
0.38458, 2060-2079, mri_cgcm3, Jan Anomaly, NPL
2.14274, 2060-2079, mri_cgcm3, Feb Anomaly, NPL
5.27387, 2060-2079, mri_cgcm3, Mar Anomaly, NPL
3.57378, 2060-2079, mri_cgcm3, Apr Anomaly, NPL
0.70785, 2060-2079, mri_cgcm3, May Anomaly, NPL
1.26311, 2060-2079, mri_cgcm3, Jun Anomaly, NPL
2.08011, 2060-2079, mri_cgcm3, Jul Anomaly, NPL
3.46627, 2060-2079, mri_cgcm3, Aug Anomaly, NPL
3.52898, 2060-2079, mri_cgcm3, Sep Anomaly, NPL
3.97992, 2060-2079, mri_cgcm3, Oct Anomaly, NPL
2.87707, 2060-2079, mri_cgcm3, Nov Anomaly, NPL
0.31973, 2060-2079, mri_cgcm3, Dec Anomaly, NPL
0.12791, 2060-2079, mri_esm1, Jan Anomaly, NPL
1.71534, 2060-2079, mri_esm1, Feb Anomaly, NPL
4.40127, 2060-2079, mri_esm1, Mar Anomaly, NPL
2.23377, 2060-2079, mri_esm1, Apr Anomaly, NPL
1.0113, 2060-2079, mri_esm1, May Anomaly, NPL
1.4082, 2060-2079, mri_esm1, Jun Anomaly, NPL
1.64632, 2060-2079, mri_esm1, Jul Anomaly, NPL
3.13404, 2060-2079, mri_esm1, Aug Anomaly, NPL
3.21112, 2060-2079, mri_esm1, Sep Anomaly, NPL
4.00825, 2060-2079, mri_esm1, Oct Anomaly, NPL
2.80535, 2060-2079, mri_esm1, Nov Anomaly, NPL
0.34296, 2060-2079, mri_esm1, Dec Anomaly, NPL
2.46676, 2060-2079, noresm1_m, Jan Anomaly, NPL
2.74824, 2060-2079, noresm1_m, Feb Anomaly, NPL
5.76435, 2060-2079, noresm1_m, Mar Anomaly, NPL
3.7058, 2060-2079, noresm1_m, Apr Anomaly, NPL
1.7002, 2060-2079, noresm1_m, May Anomaly, NPL
2.95271, 2060-2079, noresm1_m, Jun Anomaly, NPL
3.17046, 2060-2079, noresm1_m, Jul Anomaly, NPL
3.40718, 2060-2079, noresm1_m, Aug Anomaly, NPL
3.7345, 2060-2079, noresm1_m, Sep Anomaly, NPL
3.13908, 2060-2079, noresm1_m, Oct Anomaly, NPL
4.93923, 2060-2079, noresm1_m, Nov Anomaly, NPL
2.84661, 2060-2079, noresm1_m, Dec Anomaly, NPL
0.32062, 2060-2079, Ensemble (10th Percentile), Jan Anomaly, NPL
1.19246, 2060-2079, Ensemble (10th Percentile), Feb Anomaly, NPL
3.00387, 2060-2079, Ensemble (10th Percentile), Mar Anomaly, NPL
1.99781, 2060-2079, Ensemble (10th Percentile), Apr Anomaly, NPL
-0.0213, 2060-2079, Ensemble (10th Percentile), May Anomaly, NPL
0.27407, 2060-2079, Ensemble (10th Percentile), Jun Anomaly, NPL
0.14449, 2060-2079, Ensemble (10th Percentile), Jul Anomaly, NPL
0.81297, 2060-2079, Ensemble (10th Percentile), Aug Anomaly, NPL
1.4776, 2060-2079, Ensemble (10th Percentile), Sep Anomaly, NPL
1.53983, 2060-2079, Ensemble (10th Percentile), Oct Anomaly, NPL
1.579, 2060-2079, Ensemble (10th Percentile), Nov Anomaly, NPL
0.22271, 2060-2079, Ensemble (10th Percentile), Dec Anomaly, NPL
2.37475, 2060-2079, Ensemble (50th Percentile), Jan Anomaly, NPL
3.58072, 2060-2079, Ensemble (50th Percentile), Feb Anomaly, NPL
6.32752, 2060-2079, Ensemble (50th Percentile), Mar Anomaly, NPL
3.68466, 2060-2079, Ensemble (50th Percentile), Apr Anomaly, NPL
1.94937, 2060-2079, Ensemble (50th Percentile), May Anomaly, NPL
1.98716, 2060-2079, Ensemble (50th Percentile), Jun Anomaly, NPL
3.01932, 2060-2079, Ensemble (50th Percentile), Jul Anomaly, NPL
3.47508, 2060-2079, Ensemble (50th Percentile), Aug Anomaly, NPL
3.56145, 2060-2079, Ensemble (50th Percentile), Sep Anomaly, NPL
4.8241, 2060-2079, Ensemble (50th Percentile), Oct Anomaly, NPL
5.70851, 2060-2079, Ensemble (50th Percentile), Nov Anomaly, NPL
2.9371, 2060-2079, Ensemble (50th Percentile), Dec Anomaly, NPL
4.05601, 2060-2079, Ensemble (90th Percentile), Jan Anomaly, NPL
5.97371, 2060-2079, Ensemble (90th Percentile), Feb Anomaly, NPL
8.63531, 2060-2079, Ensemble (90th Percentile), Mar Anomaly, NPL
4.71714, 2060-2079, Ensemble (90th Percentile), Apr Anomaly, NPL
2.83152, 2060-2079, Ensemble (90th Percentile), May Anomaly, NPL
4.07294, 2060-2079, Ensemble (90th Percentile), Jun Anomaly, NPL
6.14798, 2060-2079, Ensemble (90th Percentile), Jul Anomaly, NPL
6.14617, 2060-2079, Ensemble (90th Percentile), Aug Anomaly, NPL
5.69462, 2060-2079, Ensemble (90th Percentile), Sep Anomaly, NPL
7.23142, 2060-2079, Ensemble (90th Percentile), Oct Anomaly, NPL
8.6134, 2060-2079, Ensemble (90th Percentile), Nov Anomaly, NPL
4.91453, 2060-2079, Ensemble (90th Percentile), Dec Anomaly, NPL
48.0129, 2060-2079, access1_0, Annual Anomaly, NPL
31.5502, 2060-2079, access1_3, Annual Anomaly, NPL
35.577, 2060-2079, bcc_csm1_1_m, Annual Anomaly, NPL
27.7731, 2060-2079, bcc_csm1_1, Annual Anomaly, NPL
39.9441, 2060-2079, bnu_esm, Annual Anomaly, NPL
52.6447, 2060-2079, canesm2, Annual Anomaly, NPL
45.7554, 2060-2079, ccsm4, Annual Anomaly, NPL
45.7734, 2060-2079, cesm1_bgc, Annual Anomaly, NPL
58.0996, 2060-2079, cesm1_cam5, Annual Anomaly, NPL
44.205, 2060-2079, cmcc_cesm, Annual Anomaly, NPL
39.9966, 2060-2079, cmcc_cm, Annual Anomaly, NPL
51.4397, 2060-2079, cmcc_cms, Annual Anomaly, NPL
26.3815, 2060-2079, cnrm_cm5, Annual Anomaly, NPL
34.3941, 2060-2079, csiro_mk3_6_0, Annual Anomaly, NPL
55.8672, 2060-2079, gfdl_cm3, Annual Anomaly, NPL
45.1163, 2060-2079, gfdl_esm2g, Annual Anomaly, NPL
42.0841, 2060-2079, gfdl_esm2m, Annual Anomaly, NPL
36.206, 2060-2079, hadgem2_ao, Annual Anomaly, NPL
47.4055, 2060-2079, hadgem2_cc, Annual Anomaly, NPL
48.8395, 2060-2079, hadgem2_es, Annual Anomaly, NPL
24.1486, 2060-2079, inmcm4, Annual Anomaly, NPL
55.9251, 2060-2079, ipsl_cm5a_lr, Annual Anomaly, NPL
54.9961, 2060-2079, ipsl_cm5a_mr, Annual Anomaly, NPL
31.0654, 2060-2079, ipsl_cm5b_lr, Annual Anomaly, NPL
36.3521, 2060-2079, miroc5, Annual Anomaly, NPL
53.4304, 2060-2079, miroc_esm_chem, Annual Anomaly, NPL
45.8831, 2060-2079, miroc_esm, Annual Anomaly, NPL
44.3624, 2060-2079, mpi_esm_lr, Annual Anomaly, NPL
45.969, 2060-2079, mpi_esm_mr, Annual Anomaly, NPL
29.5924, 2060-2079, mri_cgcm3, Annual Anomaly, NPL
26.0398, 2060-2079, mri_esm1, Annual Anomaly, NPL
40.5751, 2060-2079, noresm1_m, Annual Anomaly, NPL
22.2463, 2060-2079, Ensemble (10th Percentile), Annual Anomaly, NPL
41.9816, 2060-2079, Ensemble (50th Percentile), Annual Anomaly, NPL
61.8115, 2060-2079, Ensemble (90th Percentile), Annual Anomaly, NPL
