Number of Frost Days (Tmin < 0°C) - (Days), Year, Model, Statistics, ISO3
-1.8792, 2060-2079, bcc_csm1_1_m, Jan Anomaly, NPL
-1.1766, 2060-2079, bcc_csm1_1_m, Feb Anomaly, NPL
-1.0596, 2060-2079, bcc_csm1_1_m, Mar Anomaly, NPL
-1.0185, 2060-2079, bcc_csm1_1_m, Apr Anomaly, NPL
-2.4356, 2060-2079, bcc_csm1_1_m, May Anomaly, NPL
-1.6816, 2060-2079, bcc_csm1_1_m, Jun Anomaly, NPL
-1.0583, 2060-2079, bcc_csm1_1_m, Jul Anomaly, NPL
-1.4321, 2060-2079, bcc_csm1_1_m, Aug Anomaly, NPL
-2.0631, 2060-2079, bcc_csm1_1_m, Sep Anomaly, NPL
-1.1334, 2060-2079, bcc_csm1_1_m, Oct Anomaly, NPL
-0.4276, 2060-2079, bcc_csm1_1_m, Nov Anomaly, NPL
-1.7968, 2060-2079, bcc_csm1_1_m, Dec Anomaly, NPL
-3.8034, 2060-2079, bcc_csm1_1, Jan Anomaly, NPL
-1.3615, 2060-2079, bcc_csm1_1, Feb Anomaly, NPL
-0.5608, 2060-2079, bcc_csm1_1, Mar Anomaly, NPL
-0.8886, 2060-2079, bcc_csm1_1, Apr Anomaly, NPL
-2.1, 2060-2079, bcc_csm1_1, May Anomaly, NPL
-1.422, 2060-2079, bcc_csm1_1, Jun Anomaly, NPL
-0.4971, 2060-2079, bcc_csm1_1, Jul Anomaly, NPL
-1.1465, 2060-2079, bcc_csm1_1, Aug Anomaly, NPL
-2.0349, 2060-2079, bcc_csm1_1, Sep Anomaly, NPL
-1.096, 2060-2079, bcc_csm1_1, Oct Anomaly, NPL
-0.8318, 2060-2079, bcc_csm1_1, Nov Anomaly, NPL
-2.3162, 2060-2079, bcc_csm1_1, Dec Anomaly, NPL
-2.1757, 2060-2079, ccsm4, Jan Anomaly, NPL
-1.5939, 2060-2079, ccsm4, Feb Anomaly, NPL
-1.0251, 2060-2079, ccsm4, Mar Anomaly, NPL
-0.9888, 2060-2079, ccsm4, Apr Anomaly, NPL
-2.7638, 2060-2079, ccsm4, May Anomaly, NPL
-1.0135, 2060-2079, ccsm4, Jun Anomaly, NPL
-0.1987, 2060-2079, ccsm4, Jul Anomaly, NPL
-0.1799, 2060-2079, ccsm4, Aug Anomaly, NPL
-1.0533, 2060-2079, ccsm4, Sep Anomaly, NPL
-1.4243, 2060-2079, ccsm4, Oct Anomaly, NPL
-1.3888, 2060-2079, ccsm4, Nov Anomaly, NPL
-1.9621, 2060-2079, ccsm4, Dec Anomaly, NPL
-3.1942, 2060-2079, cesm1_cam5, Jan Anomaly, NPL
-2.5838, 2060-2079, cesm1_cam5, Feb Anomaly, NPL
-1.5245, 2060-2079, cesm1_cam5, Mar Anomaly, NPL
-1.5328, 2060-2079, cesm1_cam5, Apr Anomaly, NPL
-3.0877, 2060-2079, cesm1_cam5, May Anomaly, NPL
-0.8434, 2060-2079, cesm1_cam5, Jun Anomaly, NPL
-0.1977, 2060-2079, cesm1_cam5, Jul Anomaly, NPL
-0.1598, 2060-2079, cesm1_cam5, Aug Anomaly, NPL
-1.4871, 2060-2079, cesm1_cam5, Sep Anomaly, NPL
-2.8932, 2060-2079, cesm1_cam5, Oct Anomaly, NPL
-2.0126, 2060-2079, cesm1_cam5, Nov Anomaly, NPL
-2.503, 2060-2079, cesm1_cam5, Dec Anomaly, NPL
-2.4971, 2060-2079, csiro_mk3_6_0, Jan Anomaly, NPL
-1.9618, 2060-2079, csiro_mk3_6_0, Feb Anomaly, NPL
-1.0821, 2060-2079, csiro_mk3_6_0, Mar Anomaly, NPL
-1.5216, 2060-2079, csiro_mk3_6_0, Apr Anomaly, NPL
-2.3682, 2060-2079, csiro_mk3_6_0, May Anomaly, NPL
-1.6986, 2060-2079, csiro_mk3_6_0, Jun Anomaly, NPL
-0.7868, 2060-2079, csiro_mk3_6_0, Jul Anomaly, NPL
-1.4486, 2060-2079, csiro_mk3_6_0, Aug Anomaly, NPL
-2.6266, 2060-2079, csiro_mk3_6_0, Sep Anomaly, NPL
-1.7973, 2060-2079, csiro_mk3_6_0, Oct Anomaly, NPL
-0.8272, 2060-2079, csiro_mk3_6_0, Nov Anomaly, NPL
-2.5596, 2060-2079, csiro_mk3_6_0, Dec Anomaly, NPL
-4.1097, 2060-2079, gfdl_cm3, Jan Anomaly, NPL
-2.2001, 2060-2079, gfdl_cm3, Feb Anomaly, NPL
-1.92, 2060-2079, gfdl_cm3, Mar Anomaly, NPL
-2.5214, 2060-2079, gfdl_cm3, Apr Anomaly, NPL
-4.0584, 2060-2079, gfdl_cm3, May Anomaly, NPL
-4.1111, 2060-2079, gfdl_cm3, Jun Anomaly, NPL
-0.8088, 2060-2079, gfdl_cm3, Jul Anomaly, NPL
-0.1841, 2060-2079, gfdl_cm3, Aug Anomaly, NPL
-2.2312, 2060-2079, gfdl_cm3, Sep Anomaly, NPL
-4.3594, 2060-2079, gfdl_cm3, Oct Anomaly, NPL
-1.9831, 2060-2079, gfdl_cm3, Nov Anomaly, NPL
-3.8581, 2060-2079, gfdl_cm3, Dec Anomaly, NPL
-0.9888, 2060-2079, gfdl_esm2g, Jan Anomaly, NPL
-1.2543, 2060-2079, gfdl_esm2g, Feb Anomaly, NPL
-1.1144, 2060-2079, gfdl_esm2g, Mar Anomaly, NPL
-0.8381, 2060-2079, gfdl_esm2g, Apr Anomaly, NPL
-1.5493, 2060-2079, gfdl_esm2g, May Anomaly, NPL
-2.0306, 2060-2079, gfdl_esm2g, Jun Anomaly, NPL
-0.533, 2060-2079, gfdl_esm2g, Jul Anomaly, NPL
-0.4843, 2060-2079, gfdl_esm2g, Aug Anomaly, NPL
-1.6841, 2060-2079, gfdl_esm2g, Sep Anomaly, NPL
-0.9781, 2060-2079, gfdl_esm2g, Oct Anomaly, NPL
-1.1966, 2060-2079, gfdl_esm2g, Nov Anomaly, NPL
-0.5136, 2060-2079, gfdl_esm2g, Dec Anomaly, NPL
-1.1736, 2060-2079, gfdl_esm2m, Jan Anomaly, NPL
-0.3543, 2060-2079, gfdl_esm2m, Feb Anomaly, NPL
-1.1204, 2060-2079, gfdl_esm2m, Mar Anomaly, NPL
-0.6643, 2060-2079, gfdl_esm2m, Apr Anomaly, NPL
-2.3083, 2060-2079, gfdl_esm2m, May Anomaly, NPL
-1.0087, 2060-2079, gfdl_esm2m, Jun Anomaly, NPL
-0.4215, 2060-2079, gfdl_esm2m, Jul Anomaly, NPL
-0.5235, 2060-2079, gfdl_esm2m, Aug Anomaly, NPL
-1.9096, 2060-2079, gfdl_esm2m, Sep Anomaly, NPL
-0.962, 2060-2079, gfdl_esm2m, Oct Anomaly, NPL
-1.1054, 2060-2079, gfdl_esm2m, Nov Anomaly, NPL
-1.0045, 2060-2079, gfdl_esm2m, Dec Anomaly, NPL
-0.8462, 2060-2079, hadgem2_ao, Jan Anomaly, NPL
-0.9169, 2060-2079, hadgem2_ao, Feb Anomaly, NPL
-0.5565, 2060-2079, hadgem2_ao, Mar Anomaly, NPL
-0.9436, 2060-2079, hadgem2_ao, Apr Anomaly, NPL
-1.9704, 2060-2079, hadgem2_ao, May Anomaly, NPL
-0.8162, 2060-2079, hadgem2_ao, Jun Anomaly, NPL
-0.117, 2060-2079, hadgem2_ao, Jul Anomaly, NPL
-0.153, 2060-2079, hadgem2_ao, Aug Anomaly, NPL
-1.8984, 2060-2079, hadgem2_ao, Sep Anomaly, NPL
-0.5376, 2060-2079, hadgem2_ao, Oct Anomaly, NPL
-0.7704, 2060-2079, hadgem2_ao, Nov Anomaly, NPL
-1.295, 2060-2079, hadgem2_ao, Dec Anomaly, NPL
-1.4716, 2060-2079, hadgem2_es, Jan Anomaly, NPL
-1.8993, 2060-2079, hadgem2_es, Feb Anomaly, NPL
-0.431, 2060-2079, hadgem2_es, Mar Anomaly, NPL
-1.3501, 2060-2079, hadgem2_es, Apr Anomaly, NPL
-2.1036, 2060-2079, hadgem2_es, May Anomaly, NPL
-0.8951, 2060-2079, hadgem2_es, Jun Anomaly, NPL
-0.2785, 2060-2079, hadgem2_es, Jul Anomaly, NPL
-0.2697, 2060-2079, hadgem2_es, Aug Anomaly, NPL
-2.143, 2060-2079, hadgem2_es, Sep Anomaly, NPL
-0.8739, 2060-2079, hadgem2_es, Oct Anomaly, NPL
-1.1512, 2060-2079, hadgem2_es, Nov Anomaly, NPL
-0.7208, 2060-2079, hadgem2_es, Dec Anomaly, NPL
-2.9361, 2060-2079, ipsl_cm5a_lr, Jan Anomaly, NPL
-2.2571, 2060-2079, ipsl_cm5a_lr, Feb Anomaly, NPL
-1.7466, 2060-2079, ipsl_cm5a_lr, Mar Anomaly, NPL
-1.3515, 2060-2079, ipsl_cm5a_lr, Apr Anomaly, NPL
-2.9434, 2060-2079, ipsl_cm5a_lr, May Anomaly, NPL
-3.367, 2060-2079, ipsl_cm5a_lr, Jun Anomaly, NPL
-1.0014, 2060-2079, ipsl_cm5a_lr, Jul Anomaly, NPL
-0.0207, 2060-2079, ipsl_cm5a_lr, Aug Anomaly, NPL
-1.6692, 2060-2079, ipsl_cm5a_lr, Sep Anomaly, NPL
-2.0717, 2060-2079, ipsl_cm5a_lr, Oct Anomaly, NPL
-1.1124, 2060-2079, ipsl_cm5a_lr, Nov Anomaly, NPL
-2.2756, 2060-2079, ipsl_cm5a_lr, Dec Anomaly, NPL
-2.1693, 2060-2079, ipsl_cm5a_mr, Jan Anomaly, NPL
-1.9777, 2060-2079, ipsl_cm5a_mr, Feb Anomaly, NPL
-1.3198, 2060-2079, ipsl_cm5a_mr, Mar Anomaly, NPL
-1.5629, 2060-2079, ipsl_cm5a_mr, Apr Anomaly, NPL
-3.3852, 2060-2079, ipsl_cm5a_mr, May Anomaly, NPL
-3.7972, 2060-2079, ipsl_cm5a_mr, Jun Anomaly, NPL
-1.022, 2060-2079, ipsl_cm5a_mr, Jul Anomaly, NPL
-0.1338, 2060-2079, ipsl_cm5a_mr, Aug Anomaly, NPL
-1.8522, 2060-2079, ipsl_cm5a_mr, Sep Anomaly, NPL
-2.9747, 2060-2079, ipsl_cm5a_mr, Oct Anomaly, NPL
-0.7307, 2060-2079, ipsl_cm5a_mr, Nov Anomaly, NPL
-1.365, 2060-2079, ipsl_cm5a_mr, Dec Anomaly, NPL
-1.9354, 2060-2079, miroc5, Jan Anomaly, NPL
-2.1217, 2060-2079, miroc5, Feb Anomaly, NPL
-1.3856, 2060-2079, miroc5, Mar Anomaly, NPL
-1.1358, 2060-2079, miroc5, Apr Anomaly, NPL
-3.8902, 2060-2079, miroc5, May Anomaly, NPL
-3.8212, 2060-2079, miroc5, Jun Anomaly, NPL
-1.0324, 2060-2079, miroc5, Jul Anomaly, NPL
-0.8249, 2060-2079, miroc5, Aug Anomaly, NPL
-2.1646, 2060-2079, miroc5, Sep Anomaly, NPL
-2.5331, 2060-2079, miroc5, Oct Anomaly, NPL
-0.3399, 2060-2079, miroc5, Nov Anomaly, NPL
-1.638, 2060-2079, miroc5, Dec Anomaly, NPL
-5.5958, 2060-2079, miroc_esm_chem, Jan Anomaly, NPL
-3.1703, 2060-2079, miroc_esm_chem, Feb Anomaly, NPL
-1.8883, 2060-2079, miroc_esm_chem, Mar Anomaly, NPL
-1.3204, 2060-2079, miroc_esm_chem, Apr Anomaly, NPL
-3.1071, 2060-2079, miroc_esm_chem, May Anomaly, NPL
-2.2236, 2060-2079, miroc_esm_chem, Jun Anomaly, NPL
-0.5919, 2060-2079, miroc_esm_chem, Jul Anomaly, NPL
-0.2745, 2060-2079, miroc_esm_chem, Aug Anomaly, NPL
-1.7466, 2060-2079, miroc_esm_chem, Sep Anomaly, NPL
-3.2847, 2060-2079, miroc_esm_chem, Oct Anomaly, NPL
-1.1231, 2060-2079, miroc_esm_chem, Nov Anomaly, NPL
-2.9789, 2060-2079, miroc_esm_chem, Dec Anomaly, NPL
-3.2324, 2060-2079, miroc_esm, Jan Anomaly, NPL
-2.3026, 2060-2079, miroc_esm, Feb Anomaly, NPL
-1.7623, 2060-2079, miroc_esm, Mar Anomaly, NPL
-1.5126, 2060-2079, miroc_esm, Apr Anomaly, NPL
-2.2294, 2060-2079, miroc_esm, May Anomaly, NPL
-2.1246, 2060-2079, miroc_esm, Jun Anomaly, NPL
-0.7624, 2060-2079, miroc_esm, Jul Anomaly, NPL
-0.6441, 2060-2079, miroc_esm, Aug Anomaly, NPL
-2.1408, 2060-2079, miroc_esm, Sep Anomaly, NPL
-3.1951, 2060-2079, miroc_esm, Oct Anomaly, NPL
-0.8964, 2060-2079, miroc_esm, Nov Anomaly, NPL
-2.5466, 2060-2079, miroc_esm, Dec Anomaly, NPL
-1.5225, 2060-2079, mri_cgcm3, Jan Anomaly, NPL
-1.4339, 2060-2079, mri_cgcm3, Feb Anomaly, NPL
-1.0208, 2060-2079, mri_cgcm3, Mar Anomaly, NPL
-0.7956, 2060-2079, mri_cgcm3, Apr Anomaly, NPL
-2.3789, 2060-2079, mri_cgcm3, May Anomaly, NPL
-1.5124, 2060-2079, mri_cgcm3, Jun Anomaly, NPL
-0.1506, 2060-2079, mri_cgcm3, Jul Anomaly, NPL
-0.2306, 2060-2079, mri_cgcm3, Aug Anomaly, NPL
-2.2414, 2060-2079, mri_cgcm3, Sep Anomaly, NPL
-0.6638, 2060-2079, mri_cgcm3, Oct Anomaly, NPL
-1.0578, 2060-2079, mri_cgcm3, Nov Anomaly, NPL
-2.5509, 2060-2079, mri_cgcm3, Dec Anomaly, NPL
-2.6794, 2060-2079, noresm1_m, Jan Anomaly, NPL
-1.762, 2060-2079, noresm1_m, Feb Anomaly, NPL
-1.252, 2060-2079, noresm1_m, Mar Anomaly, NPL
-0.8336, 2060-2079, noresm1_m, Apr Anomaly, NPL
-2.5554, 2060-2079, noresm1_m, May Anomaly, NPL
-1.384, 2060-2079, noresm1_m, Jun Anomaly, NPL
-0.1507, 2060-2079, noresm1_m, Jul Anomaly, NPL
-0.1091, 2060-2079, noresm1_m, Aug Anomaly, NPL
-1.2348, 2060-2079, noresm1_m, Sep Anomaly, NPL
-1.1571, 2060-2079, noresm1_m, Oct Anomaly, NPL
-1.3189, 2060-2079, noresm1_m, Nov Anomaly, NPL
-1.862, 2060-2079, noresm1_m, Dec Anomaly, NPL
-4.7681, 2060-2079, Ensemble (10th Percentile), Jan Anomaly, NPL
-2.8119, 2060-2079, Ensemble (10th Percentile), Feb Anomaly, NPL
-2.0325, 2060-2079, Ensemble (10th Percentile), Mar Anomaly, NPL
-2.2485, 2060-2079, Ensemble (10th Percentile), Apr Anomaly, NPL
-4.247, 2060-2079, Ensemble (10th Percentile), May Anomaly, NPL
-2.2753, 2060-2079, Ensemble (10th Percentile), Jun Anomaly, NPL
-0.3133, 2060-2079, Ensemble (10th Percentile), Jul Anomaly, NPL
-0.3288, 2060-2079, Ensemble (10th Percentile), Aug Anomaly, NPL
-3.1435, 2060-2079, Ensemble (10th Percentile), Sep Anomaly, NPL
-4.9593, 2060-2079, Ensemble (10th Percentile), Oct Anomaly, NPL
-2.1331, 2060-2079, Ensemble (10th Percentile), Nov Anomaly, NPL
-3.5699, 2060-2079, Ensemble (10th Percentile), Dec Anomaly, NPL
-2.4088, 2060-2079, Ensemble (50th Percentile), Jan Anomaly, NPL
-1.6706, 2060-2079, Ensemble (50th Percentile), Feb Anomaly, NPL
-1.1428, 2060-2079, Ensemble (50th Percentile), Mar Anomaly, NPL
-1.0087, 2060-2079, Ensemble (50th Percentile), Apr Anomaly, NPL
-2.7071, 2060-2079, Ensemble (50th Percentile), May Anomaly, NPL
-1.6318, 2060-2079, Ensemble (50th Percentile), Jun Anomaly, NPL
-0.293, 2060-2079, Ensemble (50th Percentile), Jul Anomaly, NPL
-0.2956, 2060-2079, Ensemble (50th Percentile), Aug Anomaly, NPL
-2.0995, 2060-2079, Ensemble (50th Percentile), Sep Anomaly, NPL
-1.6159, 2060-2079, Ensemble (50th Percentile), Oct Anomaly, NPL
-1.2758, 2060-2079, Ensemble (50th Percentile), Nov Anomaly, NPL
-2.2616, 2060-2079, Ensemble (50th Percentile), Dec Anomaly, NPL
-1.0523, 2060-2079, Ensemble (90th Percentile), Jan Anomaly, NPL
-0.0168, 2060-2079, Ensemble (90th Percentile), Feb Anomaly, NPL
-0.5022, 2060-2079, Ensemble (90th Percentile), Mar Anomaly, NPL
-0.486, 2060-2079, Ensemble (90th Percentile), Apr Anomaly, NPL
-1.1477, 2060-2079, Ensemble (90th Percentile), May Anomaly, NPL
-0.0471, 2060-2079, Ensemble (90th Percentile), Jun Anomaly, NPL
0.02656, 2060-2079, Ensemble (90th Percentile), Jul Anomaly, NPL
0.54876, 2060-2079, Ensemble (90th Percentile), Aug Anomaly, NPL
0.6286, 2060-2079, Ensemble (90th Percentile), Sep Anomaly, NPL
0.02382, 2060-2079, Ensemble (90th Percentile), Oct Anomaly, NPL
0.21718, 2060-2079, Ensemble (90th Percentile), Nov Anomaly, NPL
0.07362, 2060-2079, Ensemble (90th Percentile), Dec Anomaly, NPL
-17.162, 2060-2079, bcc_csm1_1_m, Annual Anomaly, NPL
-18.059, 2060-2079, bcc_csm1_1, Annual Anomaly, NPL
-15.768, 2060-2079, ccsm4, Annual Anomaly, NPL
-22.02, 2060-2079, cesm1_cam5, Annual Anomaly, NPL
-21.176, 2060-2079, csiro_mk3_6_0, Annual Anomaly, NPL
-32.345, 2060-2079, gfdl_cm3, Annual Anomaly, NPL
-13.165, 2060-2079, gfdl_esm2g, Annual Anomaly, NPL
-12.556, 2060-2079, gfdl_esm2m, Annual Anomaly, NPL
-10.346, 2060-2079, hadgem2_ao, Annual Anomaly, NPL
-13.011, 2060-2079, hadgem2_es, Annual Anomaly, NPL
-22.753, 2060-2079, ipsl_cm5a_lr, Annual Anomaly, NPL
-22.29, 2060-2079, ipsl_cm5a_mr, Annual Anomaly, NPL
-22.823, 2060-2079, miroc5, Annual Anomaly, NPL
-27.304, 2060-2079, miroc_esm_chem, Annual Anomaly, NPL
-23.35, 2060-2079, miroc_esm, Annual Anomaly, NPL
-15.564, 2060-2079, mri_cgcm3, Annual Anomaly, NPL
-16.299, 2060-2079, noresm1_m, Annual Anomaly, NPL
-29.695, 2060-2079, Ensemble (10th Percentile), Annual Anomaly, NPL
-20.087, 2060-2079, Ensemble (50th Percentile), Annual Anomaly, NPL
-6.9588, 2060-2079, Ensemble (90th Percentile), Annual Anomaly, NPL
