Rainfall Amount from Very Wet Days - (Percentage), Year, Model, Statistics, ISO3
-3.8575, 2080-2099, bcc_csm1_1_m, Jan Anomaly, NPL
-6.6141, 2080-2099, bcc_csm1_1_m, Feb Anomaly, NPL
-5.4223, 2080-2099, bcc_csm1_1_m, Mar Anomaly, NPL
-1.2582, 2080-2099, bcc_csm1_1_m, Apr Anomaly, NPL
9.81918, 2080-2099, bcc_csm1_1_m, May Anomaly, NPL
13.0554, 2080-2099, bcc_csm1_1_m, Jun Anomaly, NPL
21.035, 2080-2099, bcc_csm1_1_m, Jul Anomaly, NPL
10.9376, 2080-2099, bcc_csm1_1_m, Aug Anomaly, NPL
3.26166, 2080-2099, bcc_csm1_1_m, Sep Anomaly, NPL
14.3107, 2080-2099, bcc_csm1_1_m, Oct Anomaly, NPL
13.1634, 2080-2099, bcc_csm1_1_m, Nov Anomaly, NPL
-4.3955, 2080-2099, bcc_csm1_1_m, Dec Anomaly, NPL
8.81254, 2080-2099, bcc_csm1_1, Jan Anomaly, NPL
-1.4517, 2080-2099, bcc_csm1_1, Feb Anomaly, NPL
-0.8905, 2080-2099, bcc_csm1_1, Mar Anomaly, NPL
4.01967, 2080-2099, bcc_csm1_1, Apr Anomaly, NPL
-0.2269, 2080-2099, bcc_csm1_1, May Anomaly, NPL
16.8549, 2080-2099, bcc_csm1_1, Jun Anomaly, NPL
-11.333, 2080-2099, bcc_csm1_1, Jul Anomaly, NPL
32.0192, 2080-2099, bcc_csm1_1, Aug Anomaly, NPL
3.08914, 2080-2099, bcc_csm1_1, Sep Anomaly, NPL
-3.6149, 2080-2099, bcc_csm1_1, Oct Anomaly, NPL
-3.6067, 2080-2099, bcc_csm1_1, Nov Anomaly, NPL
-0.1833, 2080-2099, bcc_csm1_1, Dec Anomaly, NPL
7.82003, 2080-2099, ccsm4, Jan Anomaly, NPL
1.15043, 2080-2099, ccsm4, Feb Anomaly, NPL
-4.0271, 2080-2099, ccsm4, Mar Anomaly, NPL
-0.0755, 2080-2099, ccsm4, Apr Anomaly, NPL
-3.3141, 2080-2099, ccsm4, May Anomaly, NPL
-21.169, 2080-2099, ccsm4, Jun Anomaly, NPL
-28.649, 2080-2099, ccsm4, Jul Anomaly, NPL
49.9517, 2080-2099, ccsm4, Aug Anomaly, NPL
47.4669, 2080-2099, ccsm4, Sep Anomaly, NPL
19.3777, 2080-2099, ccsm4, Oct Anomaly, NPL
-9.444, 2080-2099, ccsm4, Nov Anomaly, NPL
-28.735, 2080-2099, ccsm4, Dec Anomaly, NPL
-12.349, 2080-2099, cesm1_cam5, Jan Anomaly, NPL
0.78492, 2080-2099, cesm1_cam5, Feb Anomaly, NPL
0.03101, 2080-2099, cesm1_cam5, Mar Anomaly, NPL
0.69382, 2080-2099, cesm1_cam5, Apr Anomaly, NPL
8.23204, 2080-2099, cesm1_cam5, May Anomaly, NPL
-27.243, 2080-2099, cesm1_cam5, Jun Anomaly, NPL
87.3234, 2080-2099, cesm1_cam5, Jul Anomaly, NPL
147.479, 2080-2099, cesm1_cam5, Aug Anomaly, NPL
29.338, 2080-2099, cesm1_cam5, Sep Anomaly, NPL
1.92553, 2080-2099, cesm1_cam5, Oct Anomaly, NPL
6.32935, 2080-2099, cesm1_cam5, Nov Anomaly, NPL
-2.1982, 2080-2099, cesm1_cam5, Dec Anomaly, NPL
-0.4261, 2080-2099, csiro_mk3_6_0, Jan Anomaly, NPL
-7.8316, 2080-2099, csiro_mk3_6_0, Feb Anomaly, NPL
1.64916, 2080-2099, csiro_mk3_6_0, Mar Anomaly, NPL
2.46239, 2080-2099, csiro_mk3_6_0, Apr Anomaly, NPL
0.61822, 2080-2099, csiro_mk3_6_0, May Anomaly, NPL
0.9557, 2080-2099, csiro_mk3_6_0, Jun Anomaly, NPL
-11.829, 2080-2099, csiro_mk3_6_0, Jul Anomaly, NPL
3.43678, 2080-2099, csiro_mk3_6_0, Aug Anomaly, NPL
12.0831, 2080-2099, csiro_mk3_6_0, Sep Anomaly, NPL
9.44881, 2080-2099, csiro_mk3_6_0, Oct Anomaly, NPL
7.47904, 2080-2099, csiro_mk3_6_0, Nov Anomaly, NPL
2.23557, 2080-2099, csiro_mk3_6_0, Dec Anomaly, NPL
2.56142, 2080-2099, gfdl_cm3, Jan Anomaly, NPL
0.10164, 2080-2099, gfdl_cm3, Feb Anomaly, NPL
1.75918, 2080-2099, gfdl_cm3, Mar Anomaly, NPL
0.76094, 2080-2099, gfdl_cm3, Apr Anomaly, NPL
-3.1073, 2080-2099, gfdl_cm3, May Anomaly, NPL
18.7652, 2080-2099, gfdl_cm3, Jun Anomaly, NPL
45.5829, 2080-2099, gfdl_cm3, Jul Anomaly, NPL
55.6801, 2080-2099, gfdl_cm3, Aug Anomaly, NPL
-23.586, 2080-2099, gfdl_cm3, Sep Anomaly, NPL
-8.3253, 2080-2099, gfdl_cm3, Oct Anomaly, NPL
-9.1099, 2080-2099, gfdl_cm3, Nov Anomaly, NPL
-22.355, 2080-2099, gfdl_cm3, Dec Anomaly, NPL
-1.9475, 2080-2099, gfdl_esm2g, Jan Anomaly, NPL
-1.4896, 2080-2099, gfdl_esm2g, Feb Anomaly, NPL
0.95879, 2080-2099, gfdl_esm2g, Mar Anomaly, NPL
-0.1583, 2080-2099, gfdl_esm2g, Apr Anomaly, NPL
-0.6706, 2080-2099, gfdl_esm2g, May Anomaly, NPL
10.442, 2080-2099, gfdl_esm2g, Jun Anomaly, NPL
57.9512, 2080-2099, gfdl_esm2g, Jul Anomaly, NPL
78.1736, 2080-2099, gfdl_esm2g, Aug Anomaly, NPL
-6.009, 2080-2099, gfdl_esm2g, Sep Anomaly, NPL
-12.388, 2080-2099, gfdl_esm2g, Oct Anomaly, NPL
6.87915, 2080-2099, gfdl_esm2g, Nov Anomaly, NPL
-0.832, 2080-2099, gfdl_esm2g, Dec Anomaly, NPL
-3.0846, 2080-2099, gfdl_esm2m, Jan Anomaly, NPL
-2.3151, 2080-2099, gfdl_esm2m, Feb Anomaly, NPL
2.49028, 2080-2099, gfdl_esm2m, Mar Anomaly, NPL
-0.6466, 2080-2099, gfdl_esm2m, Apr Anomaly, NPL
0.62479, 2080-2099, gfdl_esm2m, May Anomaly, NPL
-12.15, 2080-2099, gfdl_esm2m, Jun Anomaly, NPL
64.7837, 2080-2099, gfdl_esm2m, Jul Anomaly, NPL
0.35157, 2080-2099, gfdl_esm2m, Aug Anomaly, NPL
12.3107, 2080-2099, gfdl_esm2m, Sep Anomaly, NPL
-7.0326, 2080-2099, gfdl_esm2m, Oct Anomaly, NPL
-9.8869, 2080-2099, gfdl_esm2m, Nov Anomaly, NPL
-0.2261, 2080-2099, gfdl_esm2m, Dec Anomaly, NPL
-1.3883, 2080-2099, hadgem2_ao, Jan Anomaly, NPL
-3.2579, 2080-2099, hadgem2_ao, Feb Anomaly, NPL
-2.0574, 2080-2099, hadgem2_ao, Mar Anomaly, NPL
-0.1529, 2080-2099, hadgem2_ao, Apr Anomaly, NPL
9.02209, 2080-2099, hadgem2_ao, May Anomaly, NPL
47.4793, 2080-2099, hadgem2_ao, Jun Anomaly, NPL
28.0393, 2080-2099, hadgem2_ao, Jul Anomaly, NPL
11.5153, 2080-2099, hadgem2_ao, Aug Anomaly, NPL
9.41725, 2080-2099, hadgem2_ao, Sep Anomaly, NPL
-3.9602, 2080-2099, hadgem2_ao, Oct Anomaly, NPL
-2.1953, 2080-2099, hadgem2_ao, Nov Anomaly, NPL
4.50039, 2080-2099, hadgem2_ao, Dec Anomaly, NPL
4.7908, 2080-2099, hadgem2_es, Jan Anomaly, NPL
-1.4603, 2080-2099, hadgem2_es, Feb Anomaly, NPL
1.86267, 2080-2099, hadgem2_es, Mar Anomaly, NPL
-0.9407, 2080-2099, hadgem2_es, Apr Anomaly, NPL
2.97545, 2080-2099, hadgem2_es, May Anomaly, NPL
-8.8422, 2080-2099, hadgem2_es, Jun Anomaly, NPL
33.8337, 2080-2099, hadgem2_es, Jul Anomaly, NPL
11.9806, 2080-2099, hadgem2_es, Aug Anomaly, NPL
-0.7537, 2080-2099, hadgem2_es, Sep Anomaly, NPL
5.96315, 2080-2099, hadgem2_es, Oct Anomaly, NPL
-0.0091, 2080-2099, hadgem2_es, Nov Anomaly, NPL
-1.3878, 2080-2099, hadgem2_es, Dec Anomaly, NPL
-3.8798, 2080-2099, ipsl_cm5a_lr, Jan Anomaly, NPL
-0.2502, 2080-2099, ipsl_cm5a_lr, Feb Anomaly, NPL
-6.1682, 2080-2099, ipsl_cm5a_lr, Mar Anomaly, NPL
-2.7343, 2080-2099, ipsl_cm5a_lr, Apr Anomaly, NPL
-1.9138, 2080-2099, ipsl_cm5a_lr, May Anomaly, NPL
2.69516, 2080-2099, ipsl_cm5a_lr, Jun Anomaly, NPL
9.61603, 2080-2099, ipsl_cm5a_lr, Jul Anomaly, NPL
39.9108, 2080-2099, ipsl_cm5a_lr, Aug Anomaly, NPL
10.8603, 2080-2099, ipsl_cm5a_lr, Sep Anomaly, NPL
-34.105, 2080-2099, ipsl_cm5a_lr, Oct Anomaly, NPL
-4.1147, 2080-2099, ipsl_cm5a_lr, Nov Anomaly, NPL
-6.4248, 2080-2099, ipsl_cm5a_lr, Dec Anomaly, NPL
1.81911, 2080-2099, ipsl_cm5a_mr, Jan Anomaly, NPL
-2.1034, 2080-2099, ipsl_cm5a_mr, Feb Anomaly, NPL
2.88415, 2080-2099, ipsl_cm5a_mr, Mar Anomaly, NPL
3.71315, 2080-2099, ipsl_cm5a_mr, Apr Anomaly, NPL
5.17309, 2080-2099, ipsl_cm5a_mr, May Anomaly, NPL
12.8459, 2080-2099, ipsl_cm5a_mr, Jun Anomaly, NPL
6.56362, 2080-2099, ipsl_cm5a_mr, Jul Anomaly, NPL
56.3857, 2080-2099, ipsl_cm5a_mr, Aug Anomaly, NPL
-2.3897, 2080-2099, ipsl_cm5a_mr, Sep Anomaly, NPL
27.4381, 2080-2099, ipsl_cm5a_mr, Oct Anomaly, NPL
-10.596, 2080-2099, ipsl_cm5a_mr, Nov Anomaly, NPL
-3.4233, 2080-2099, ipsl_cm5a_mr, Dec Anomaly, NPL
-0.7283, 2080-2099, miroc5, Jan Anomaly, NPL
-0.4725, 2080-2099, miroc5, Feb Anomaly, NPL
-1.0644, 2080-2099, miroc5, Mar Anomaly, NPL
-0.604, 2080-2099, miroc5, Apr Anomaly, NPL
29.1199, 2080-2099, miroc5, May Anomaly, NPL
49.6472, 2080-2099, miroc5, Jun Anomaly, NPL
-7.4135, 2080-2099, miroc5, Jul Anomaly, NPL
51.423, 2080-2099, miroc5, Aug Anomaly, NPL
-13.132, 2080-2099, miroc5, Sep Anomaly, NPL
3.86875, 2080-2099, miroc5, Oct Anomaly, NPL
2.53962, 2080-2099, miroc5, Nov Anomaly, NPL
6.59384, 2080-2099, miroc5, Dec Anomaly, NPL
-3.54, 2080-2099, miroc_esm_chem, Jan Anomaly, NPL
-4.656, 2080-2099, miroc_esm_chem, Feb Anomaly, NPL
-2.0118, 2080-2099, miroc_esm_chem, Mar Anomaly, NPL
-3.356, 2080-2099, miroc_esm_chem, Apr Anomaly, NPL
-4.3485, 2080-2099, miroc_esm_chem, May Anomaly, NPL
14.3101, 2080-2099, miroc_esm_chem, Jun Anomaly, NPL
67.9399, 2080-2099, miroc_esm_chem, Jul Anomaly, NPL
12.3741, 2080-2099, miroc_esm_chem, Aug Anomaly, NPL
-1.9857, 2080-2099, miroc_esm_chem, Sep Anomaly, NPL
-13.852, 2080-2099, miroc_esm_chem, Oct Anomaly, NPL
-21.88, 2080-2099, miroc_esm_chem, Nov Anomaly, NPL
-5.084, 2080-2099, miroc_esm_chem, Dec Anomaly, NPL
-0.7709, 2080-2099, miroc_esm, Jan Anomaly, NPL
-4.9085, 2080-2099, miroc_esm, Feb Anomaly, NPL
-2.7228, 2080-2099, miroc_esm, Mar Anomaly, NPL
0.38277, 2080-2099, miroc_esm, Apr Anomaly, NPL
-8.1646, 2080-2099, miroc_esm, May Anomaly, NPL
9.59263, 2080-2099, miroc_esm, Jun Anomaly, NPL
31.3561, 2080-2099, miroc_esm, Jul Anomaly, NPL
2.18244, 2080-2099, miroc_esm, Aug Anomaly, NPL
27.4008, 2080-2099, miroc_esm, Sep Anomaly, NPL
-11.133, 2080-2099, miroc_esm, Oct Anomaly, NPL
-0.482, 2080-2099, miroc_esm, Nov Anomaly, NPL
0.01419, 2080-2099, miroc_esm, Dec Anomaly, NPL
2.04844, 2080-2099, mri_cgcm3, Jan Anomaly, NPL
1.82544, 2080-2099, mri_cgcm3, Feb Anomaly, NPL
-2.3224, 2080-2099, mri_cgcm3, Mar Anomaly, NPL
-0.3593, 2080-2099, mri_cgcm3, Apr Anomaly, NPL
-0.0707, 2080-2099, mri_cgcm3, May Anomaly, NPL
11.1323, 2080-2099, mri_cgcm3, Jun Anomaly, NPL
30.4393, 2080-2099, mri_cgcm3, Jul Anomaly, NPL
9.9263, 2080-2099, mri_cgcm3, Aug Anomaly, NPL
8.63871, 2080-2099, mri_cgcm3, Sep Anomaly, NPL
-0.8711, 2080-2099, mri_cgcm3, Oct Anomaly, NPL
-11.523, 2080-2099, mri_cgcm3, Nov Anomaly, NPL
2.26554, 2080-2099, mri_cgcm3, Dec Anomaly, NPL
0.81199, 2080-2099, noresm1_m, Jan Anomaly, NPL
-0.1134, 2080-2099, noresm1_m, Feb Anomaly, NPL
-3.0668, 2080-2099, noresm1_m, Mar Anomaly, NPL
5.21525, 2080-2099, noresm1_m, Jun Anomaly, NPL
86.6828, 2080-2099, noresm1_m, Jul Anomaly, NPL
-14.473, 2080-2099, noresm1_m, Aug Anomaly, NPL
25.5844, 2080-2099, noresm1_m, Sep Anomaly, NPL
-2.8688, 2080-2099, noresm1_m, Oct Anomaly, NPL
-3.6023, 2080-2099, noresm1_m, Nov Anomaly, NPL
9.65138, 2080-2099, noresm1_m, Dec Anomaly, NPL
-6.3609, 2080-2099, Ensemble (10th Percentile), Jan Anomaly, NPL
-6.6714, 2080-2099, Ensemble (10th Percentile), Feb Anomaly, NPL
-4.4594, 2080-2099, Ensemble (10th Percentile), Mar Anomaly, NPL
-1.0621, 2080-2099, Ensemble (10th Percentile), Apr Anomaly, NPL
-2.2313, 2080-2099, Ensemble (10th Percentile), May Anomaly, NPL
-25.212, 2080-2099, Ensemble (10th Percentile), Jun Anomaly, NPL
-84.166, 2080-2099, Ensemble (10th Percentile), Jul Anomaly, NPL
-46.807, 2080-2099, Ensemble (10th Percentile), Aug Anomaly, NPL
-8.1611, 2080-2099, Ensemble (10th Percentile), Sep Anomaly, NPL
-9.0314, 2080-2099, Ensemble (10th Percentile), Oct Anomaly, NPL
-8.8593, 2080-2099, Ensemble (10th Percentile), Nov Anomaly, NPL
-6.2157, 2080-2099, Ensemble (10th Percentile), Dec Anomaly, NPL
-2.1438, 2080-2099, Ensemble (50th Percentile), Jan Anomaly, NPL
-3.2791, 2080-2099, Ensemble (50th Percentile), Feb Anomaly, NPL
-3.1613, 2080-2099, Ensemble (50th Percentile), Mar Anomaly, NPL
-0.1948, 2080-2099, Ensemble (50th Percentile), Apr Anomaly, NPL
-0.6522, 2080-2099, Ensemble (50th Percentile), May Anomaly, NPL
16.0118, 2080-2099, Ensemble (50th Percentile), Jun Anomaly, NPL
22.8229, 2080-2099, Ensemble (50th Percentile), Jul Anomaly, NPL
21.6812, 2080-2099, Ensemble (50th Percentile), Aug Anomaly, NPL
16.1543, 2080-2099, Ensemble (50th Percentile), Sep Anomaly, NPL
4.29938, 2080-2099, Ensemble (50th Percentile), Oct Anomaly, NPL
-0.4195, 2080-2099, Ensemble (50th Percentile), Nov Anomaly, NPL
1.40151, 2080-2099, Ensemble (50th Percentile), Dec Anomaly, NPL
16.8121, 2080-2099, Ensemble (90th Percentile), Jan Anomaly, NPL
7.98808, 2080-2099, Ensemble (90th Percentile), Feb Anomaly, NPL
9.66123, 2080-2099, Ensemble (90th Percentile), Mar Anomaly, NPL
6.26545, 2080-2099, Ensemble (90th Percentile), Apr Anomaly, NPL
32.6922, 2080-2099, Ensemble (90th Percentile), May Anomaly, NPL
123.255, 2080-2099, Ensemble (90th Percentile), Jun Anomaly, NPL
243.527, 2080-2099, Ensemble (90th Percentile), Jul Anomaly, NPL
194.199, 2080-2099, Ensemble (90th Percentile), Aug Anomaly, NPL
84.6127, 2080-2099, Ensemble (90th Percentile), Sep Anomaly, NPL
41.9824, 2080-2099, Ensemble (90th Percentile), Oct Anomaly, NPL
20.3744, 2080-2099, Ensemble (90th Percentile), Nov Anomaly, NPL
12.6538, 2080-2099, Ensemble (90th Percentile), Dec Anomaly, NPL
64.0355, 2080-2099, bcc_csm1_1_m, Annual Anomaly, NPL
43.4879, 2080-2099, bcc_csm1_1, Annual Anomaly, NPL
30.3524, 2080-2099, ccsm4, Annual Anomaly, NPL
240.345, 2080-2099, cesm1_cam5, Annual Anomaly, NPL
20.2813, 2080-2099, csiro_mk3_6_0, Annual Anomaly, NPL
58.7271, 2080-2099, gfdl_cm3, Annual Anomaly, NPL
130.909, 2080-2099, gfdl_esm2g, Annual Anomaly, NPL
45.2181, 2080-2099, gfdl_esm2m, Annual Anomaly, NPL
92.278, 2080-2099, hadgem2_ao, Annual Anomaly, NPL
65.3763, 2080-2099, hadgem2_es, Annual Anomaly, NPL
3.49096, 2080-2099, ipsl_cm5a_lr, Annual Anomaly, NPL
98.3102, 2080-2099, ipsl_cm5a_mr, Annual Anomaly, NPL
119.777, 2080-2099, miroc5, Annual Anomaly, NPL
33.9211, 2080-2099, miroc_esm_chem, Annual Anomaly, NPL
42.7097, 2080-2099, miroc_esm, Annual Anomaly, NPL
50.9971, 2080-2099, mri_cgcm3, Annual Anomaly, NPL
103.82, 2080-2099, noresm1_m, Annual Anomaly, NPL
-163.35, 2080-2099, Ensemble (10th Percentile), Annual Anomaly, NPL
63.0002, 2080-2099, Ensemble (50th Percentile), Annual Anomaly, NPL
504.502, 2080-2099, Ensemble (90th Percentile), Annual Anomaly, NPL
